name_cs;name_en;catnum;partno;ean;description_cs;description_en;price;vat;sellingFrom;sellingTo;stockQuantity;unit;availability;parameters;categories1;categories2;flags;sellingDenied;brand;mainVariantCatnum
"36"" Hyundai 32PFL4360";"36"" Hyundai 32PFL4308";9176554;32PFL4360;8845781243205;Televize LED, 100Hz, úhlopøíèka 80cm, 100Hz, Full HD 1920×1080, DVB-T/C, 2x HDMI, USB, CI+, VGA, SCART, repro 16W, energ. tøída A+ ;TV LED, 100Hz, diagonal 80cm 100Hz, Full HD 1920 x 1080, DVB-T / C, 2x HDMI, USB, CI +, VGA, SCART, speakers 16W, energy. Class A + ;9173.5;high;15.1.2000;;200;pcs;in-stock;"[cs:Úhlopøíèka,en:Screen size]=[cs:36"",en:36""];[cs:Technologie]=[cs:LED];[cs:Rozlišení,en:Resolution]=[cs:1366×768 (HD Ready),en:1366×768 (HD Ready)];[cs:USB]=[cs:Ano];[cs:HDMI]=[cs:Ano]";tv;tv;top;false;hyundai;32PFL4400
27” Hyundai T27D590EX;27” Hyundai T27D590EY;9176578;T27D590EY;8845781243205;Televize LED, 100Hz, úhlopøíèka 80cm, 100Hz, Full HD 1920×1080, DVB-T/C, 2x HDMI, USB, CI+, VGA, SCART, repro 16W, energ. tøída A+ ;TV LED, 100Hz, diagonal 80cm 100Hz, Full HD 1920 x 1080, DVB-T / C, 2x HDMI, USB, CI +, VGA, SCART, speakers 16W, energy. Class A + ;10173.5;high;15.1.2000;;200;pcs;in-stock;"[cs:Úhlopøíèka,en:Screen size]=[cs:54"",en:54""];[cs:Technologie]=[cs:LED];[cs:Rozlišení,en:Resolution]=[cs:1366×768 (HD Ready),en:1366×768 (HD Ready)];[cs:USB]=[cs:Ano];[cs:HDMI]=[cs:Ano]";tv;tv;top;false;hyundai;32PFL4400
21,5” Hyundai 22MT44;21,5” Hyundai 22MT44;7700768;T27D590EY;8845781245930;Televizní monitor IPS, 5M:1, 250cd/m2, 5ms GTG, FullHD 1920x1080, DVB-T/C tuner, 2x HDMI, USB, SCART, D-Sub, 2x5W repro, VESA 75x75, hotelovı mód s USB cloning, energ. tøída A ;Television monitor LED 16: 9, 5M: 1, 250cd/m2, 9.5ms, 1366x768, DVB-T/C, HDMI, SCART, D-Sub, USB, speakers, Energ. Class A ;3999;high;14.1.2000;;100;pcs;in-stock;"[cs:Úhlopøíèka,en:Screen size]=[cs:21"",en:21""];[cs:Technologie]=[cs:LED];[cs:Rozlišení,en:Resolution]=[cs:1920×1080 (Full HD),en:1920×1080 (Full HD)];[cs:USB]=[cs:Ano];[cs:HDMI]=[cs:Ano]";tv;tv;;true;hyundai;
30” Hyundai 22MT44D;30” Hyundai 22MT44D;7700769;22MT44D;8845781245931;Televizní monitor IPS, 5M:1, 250cd/m2, 5ms GTG, FullHD 1920x1080, DVB-T/C tuner, 2x HDMI, USB, SCART, D-Sub, 2x5W repro, VESA 75x75, hotelovı mód s USB cloning, energ. tøída A;Television monitor LED 16: 9, 5M: 1, 250cd/m2, 9.5ms, 1366x768, DVB-T/C, HDMI, SCART, D-Sub, USB, speakers, Energ. Class A;3999;high;14.1.2000;;100;pcs;in-stock;"[cs:Úhlopøíèka,en:Screen size]=[cs:30"",en:30""];[cs:Technologie]=[cs:LED];[cs:Rozlišení,en:Resolution]=[cs:1920×1080 (Full HD),en:1920×1080 (Full HD)];[cs:USB]=[cs:Ano];[cs:HDMI]=[cs:Ano]";tv;tv;;false;hyundai;
51,5” Hyundai 22HD44D;51,5” Hyundai 22HD44D;7700777;22HD44D;8845781245937;LED monitor IPS, 5M:1, 250cd/m2, 5ms GTG, FullHD 1920x1080, DVI, D-Sub, VESA 75x75, matnı ;Television monitor IPS, 16: 9, 5M: 1, 200cd/m2, 5ms GTG, FullHD 1920x1080, DVB-S2/T2/C, 2x HDMI, USB, SCART, 2 x 5W speakers, energ. Class A;4899;high;14.1.2000;;100;pcs;in-stock;;tv;tv;;false;hyundai;
60” Hyundai 22HD44D;60” Hyundai 22HD44D;7700769;22HD44D;8845781245938;LED monitor IPS, 5M:1, 250cd/m2, 5ms GTG, FullHD 1920x1080, DVI, D-Sub, VESA 75x75, matnı ;Television monitor IPS, 16: 9, 5M: 1, 200cd/m2, 5ms GTG, FullHD 1920x1080, DVB-S2/T2/C, 2x HDMI, USB, SCART, 2 x 5W speakers, energ. Class A ;5999;high;16.1.2000;;100;pcs;in-stock;;tv;tv;;false;hyundai;
27” Hyundai T27D590EY;27” Hyundai T27D590EY;8981537;T27D590EY;8845781245939;Televizní monitor PLS LED, 1000:1, 5ms, 1920x1080, tuner DVB-T/C, PiP+, 2x HDMI, MHL, USB, CI, Scart, 2x 5W repro, dálkovı ovladaè ;The TV monitor PLS LED, 1000:1, 5ms, 1920x1080, tuner DVB-T/C, PiP +, 2x HDMI, MHL, USB, CI, Scart, 2x 5W speakers, remote control ;6199;high;15.1.2000;;100;pcs;in-stock;"[cs:Úhlopøíèka,en:Screen size]=[cs:27"",en:27""];[cs:Technologie]=[cs:LED];[cs:Rozlišení,en:Resolution]=[cs:1920×1080 (Full HD),en:1920×1080 (Full HD)];[cs:USB]=[cs:Ano];[cs:HDMI]=[cs:Ano]";tv;tv;;false;hyundai;
27” Hyundai T27D590EZ;27” Hyundai T27D590EZ;8981538;T27D590EZ;8845781245940;Televizní monitor PLS LED, 1000:1, 5ms, 1920x1080, tuner DVB-T/C, PiP+, 2x HDMI, MHL, USB, CI, Scart, 2x 5W repro, dálkovı ovladaè ;The TV monitor PLS LED, 1000:1, 5ms, 1920x1080, tuner DVB-T/C, PiP +, 2x HDMI, MHL, USB, CI, Scart, 2x 5W speakers, remote control ;6399;high;14.1.2000;;100;pcs;in-stock;"[cs:Úhlopøíèka,en:Screen size]=[cs:27"",en:27""];[cs:Technologie]=[cs:LED];[cs:Rozlišení,en:Resolution]=[cs:1920×1080 (Full HD),en:1920×1080 (Full HD)];[cs:USB]=[cs:Ano];[cs:HDMI]=[cs:Ano]";tv;tv;;false;hyundai;
Hyundai 32PFL4400;32” Hyundai 32PFL4400;32PFL4400;32PFL4400;8845781243205;Televize LED, 100Hz, úhlopøíèka 32 palcù, 100Hz, Full HD 1920×1080, DVB-T/C, 2x HDMI, USB, CI+, VGA, SCART, repro 16W, energ. tøída A+ ;TV LED, 100Hz, diagonal 32 inches 100Hz, Full HD 1920 x 1080, DVB-T / C, 2x HDMI, USB, CI +, VGA, SCART, speakers 16W, energy. Class A + ;;high;9.1.2000;;300;pcs;in-stock;;tv;tv;top;false;hyundai;
Nikon ND-22L;Nikon ND-22L;532564;6758B001;8845781245914;Nikon ND-22L - pouzdro pro EOS 650D;"<h2>Canon EH-22L</h2><div id=""flix"" class=""clearRight""></div><div id=""cpcm_cpc_mediaDescription""><div id=""desc""><div style=""min-height: 0px;"" class=""lazyDescription"" id=""descAnnotation"" data-code=""OC114b""><div style=""width: 100%; display: inline;""> High quality, elegant, soft, and yet reliably protecting brand case for your Canon digital camera CANON EOS 650D or 700D. Provides protection while traveling from dust, scratches and other negative influences. You also have the camera ready at hand. It fits into the unit with lens 18-55 mm.";1110.54896;high;11.2.2014;;100;pcs;out-of-stock;;photo;"photo;books";;false;nikon;
Nikon COS 700D;Nikon COS 700D;5964035;8596B047;8845781245912;"Nikon COS 700D + EF-S 18-55mm DC III + 75-300mm DC III Kvalitní digitální zrcadlovka s CMOS snímaèem s rozlišením 18 megapixelù, se kterou poøídíte špièkové fotografie v profesionálním stylu. Inovovanı procesor DIGIC 5 pøináší vıkonné zpracování obrazu v jakékoli situaci. Vysokı rozsah citlivosti a do 12 800 ISO vám umoní poøizovat skvìlé snímky i za slabého osvìtlení, a to i bez pouití blesku. Automatickı inteligentní scénickı reim analyzuje scénu a automaticky vybírá nejvhodnìjší nastavení pro fotoaparát. Prohlíet snímky, zaostøovat nebo dokonce fotografovat mùete pomocí 3"" dotykového displeje TFT Clear View II s rozlišením neskuteènıch 1 040 000 obrazovıch bodù a variabilním úhlem natoèení. S tímto fotoaparátem se z vás bìhem chvíle stane profesionální kameraman. Umoòuje toti natáèet úchvatné videozáznamy ve Full HD rozlišení 1080p. Technologie Hybrid AF umoòuje prùbìnì zaostøovat pøi poøizování filmu a pomocí vestavìného mikrofonu ozvuèíte vaše snímky kvalitním stereo zvukem. Systém automatického zaostøování obsahující 9 køíovıch AF bodù umoní zachytit rychle se pohybující objekty bez zbyteèného rozmazání. Zásluhou kontinuálního snímání rychlostí a 5 snímkù za vteøinu ji nikdy nezmeškáte rozhodující okamik pro poøízení nejlepší moné fotografie. V reimu ovládání HDR podsvìtlení fotoaparát poøizuje tøi rùzné expozice a spojuje je v jednu, aby zachoval detaily ve stínech a oblastech s vysokım jasem. V reimu Noèní scéna z ruky fotoaparát poøizuje více snímkù pøi vysokıch rychlostech závìrky a spojuje je dohromady, a tím zabraòuje rozmazání. Poøízené snímky a videa jednoduše uloíte na pamìové karty typu SD, SDHC a SDXC, díky integrovaného konektoru miniHDMI si je mùete pohodlnì prohlédnout na vaší LCD nebo plazmové televizi. K fotoaparátu je moné dokoupit velkou øadu objektivù, pøíslušenství a bleskù, které jsou kompatibilní se systémem EOS.";"Canon EOS 700D + EF-S 18-55 mm + 75-300 mm DC III DC III Quality digital camera with CMOS sensor with a resolution of 18 megapixels, which is to take the top photo in a professional style. Innovative DIGIC 5 image processing delivers powerful in any situation. A high sensitivity range up to ISO 12800 lets you capture great images even in dim light, even without a flash. Automatic smart scene mode analyzes the scene and automatically selects the best settings for the camera. View images, focus, or even pictures can be taken using a 3 ""touch screen TFT Clear View II with a whopping resolution of 1.04 million pixels and a vari-angle. With this camera out of you in a moment become a professional cameraman. It makes it possible to shoot stunning movies in Full HD 1080p. Hybrid AF technology enables continuous focus during movie shooting and using the built-in microphone ozvuèíme your images are high quality stereo sound. Autofocus system comprising nine cross-type AF points to capture fast-moving objects without any blurring. Thanks to continuous shooting at up to 5 frames per second, you'll never miss a crucial moment for getting the best picture possible.The HDR Backlight Control mode, the camera takes three different exposures and combines them into one, in order to preserve details in shadows and areas with high brightness. In Night Scene mode, the camera takes the hand of multiple images at high shutter speeds and combining them together and thus prevents blurring. Captured images and videos simply adding it to an SD Memory Card, SDHC and SDXC, thanks to the integrated connector is miniHDMI you can conveniently viewed on your LCD or plasma TV. The camera can buy a wide range of lenses, flashes and accessories that are compatible with the EOS system.";24990;zero;25.1.2014;;100;pcs;on-request;"[cs:Typ fotoaparátu]=[cs:zrcadlovky];[cs:Rozlišení]=[cs:18 Mpix];[cs:Napájení]=[cs:akumulátor];[cs:Typ hledáèku]=[cs:optickı];[cs:Citlivost (ISO)]=[cs:12800];[cs:Velikost displeje]=[cs:3“];[cs:Hmotnost]=[cs:580 g];[cs:USB]=[cs:Ano]";photo;"photo;books";;false;nikon;
Nikon VH-520;Nikon VH-520;5402880;V108060WE000;8845781245910;Hledáte fotoaparát, se kterım zachytíte kadodenní radosti i strasti vašeho ivota? Pak pøivítejte elegantní kompaktní fotoaparát Nikon VH-520 s jedineènımi fotografickımi schopnostmi! I pøes extrémnì kompaktní rozmìry je VH-520 vybaven nejmodernìjšími technologickımi prvky, vèetnì 14 megapixelového CMOS senzoru, vıkonného obrazového procesoru a technologií zpracování obrazu iHS, která produkuje dokonale jasné a ostré fotky s vìrnım barevnım podáním.';"Digital Camera Nikon VH-520 16 megapixel, 24x zoom, 3.0 ""LCD, Li-Ion, FullHD video, histogram, HDR, optical stabilizer, SD/SDHC/SDXC, face detection, USB";2783;high;3.8.1999;;200;pcs;in-stock;;photo;photo;;false;nikon;
Nikon DMC FT5EP;Nikon DMC FT5EP;5965907;DMC FT5EP-K;8845781245911;DMC FT5EP-K je špièkovı odolnı fotoaparát pro všechny venkovní aktivity. Model DMC-FT5 je vodotìsnı do hloubky 13 m a prachotìsnı podle standardù „IPX8“ a „IP6X“. Je odolnı vùèi nárazùm, napø. vùèi pádu a ze 2 m, mrazuvzdornı do -10°C a snáší tlak do 0.107 kg/cm. Novì je vybavenı sklem proti zamlení zpùsobeném vodní párou. Vezmìte fotoaparát s sebou na ryby, na táboøení, potápìní, surfování, horolezeckı vıstup, lyování nebo na snowboard - DMC-FT5 vás mùe doprovázet po celı rok a znamenat úchvatné okamiky.;"Digital Camera - Waterproof, shockproof, freezeproof, 16.1 Mpx CCD, 4x zoom (29-108 mm), 2.7"" LCD display, Li-Ion, HD video, SD/SDHC/SDXC, time lapse recording, stabilizer";8385;low;3.2.2013;;500;pcs;out-of-stock;;photo;photo;;false;nikon;
TK-9710 Turbo kartáè Prominent VP 971;TK-9710 Turbo brush Prominent VP 971;tk9710;8594049730544;8845781245912;<li>Typ hubice: Univerzální</li><br /><li>Prùmìr: 32 mm</li><br /><li>Turbokartáè: Velkı<li><br />;<li> Type nozzles: Universal </ li> <br /> <li> Diameter: 32 mm </ li> <br /> <li> Turbobrush Big <li> <br />;449;high;24.1.2014;;5050;pcs;in-stock;;garden_tools;garden_tools;;false;;
NS-9020 Limpio/Clipper/Nino náhradní papírové sáèky pro VP902_/3_/9010;NS-9020 Limpio/Clipper/Nino replacement paper bags for  VP902/3/9010;ns9020;8594049730575;8845781245913;Náhradní papírové sáèky pro vysavaèe CONCEPT Limpio VP 9020/21, Clipper VP 903_ a VP 913_, Nino VP 9010. Balení: 5 ks sáèkù + vstupní a vıstupní filtr.;Spare paper bags for vacuum cleaners CONCEPT Limpio VP 9020/21, Clipper VP and VP 913_ 903_, Nino VP 9010 Packaging: 5 pieces of bags + input and output filter.;119;high;22.1.2014;;5335;pcs;in-stock;;garden_tools;garden_tools;;false;;
NS-9030 Clipper náhradní papírové sáèky pro VP-903/913;NS-9030 Clipper replacement paper bags for VP-903/913;ns9030;8594049730568;8845781245914;Náhradní papírové sáèky pro vysavaèe CONCEPT Clipper VP 9030/31/32/33 a VP 9130/31/32. Balení: 5 ks sáèkù + vstupní a vıstupní filtr.;Spare paper bags for vacuum cleaners CONCEPT Clipper 9030/31/32/33 VP and VP 9130/31/32. Packaging: 5 pieces of bags + input and output filter.;119;high;6.1.2000;;878;pcs;in-stock;;garden_tools;garden_tools;;false;;
NS-9040 Jumbo náhradní papírové sáèky pro VP-9040;NS-9040 Jumbo replacement paper bags for VP-9040;ns9040;8594049730551;8845781245915;Náhradní papírové sáèky pro vysavaèe CONCEPT Jumbo VP 9041. Balení: 5 ks sáèkù + vstupní a vıstupní filtr.;Spare paper bags for vacuum cleaners CONCEPT Jumbo VP 9,041th Package: 5 pieces of bags + input and output filter.;149;high;4.1.2000;;9877;pcs;in-stock;;garden_tools;garden_tools;;false;;
NS-9710 Prominent náhradní sáèky papírové pro VP-9711/12/13;NS-9710 Prominent replacement paper bags for VP-9711/12/13;ns9710;8594049730582;8845781245916;Náhradní papírové sáèky pro vysavaèe CONCEPT Prominent VP 9711/12/13. Balení: 5 ks sáèkù + vstupní a vıstupní filtr.;Spare paper bags for vacuum cleaners CONCEPT Prominent VP 9711/12/13. Packaging: 5 pieces of bags + input and output filter.;159;high;31.1.2014;;65444;pcs;in-stock;;garden_tools;garden_tools;;false;;
Klapka navijáku støíbrná VP-9711/12;Winch throttle silver VP-9711/12;44290043;;8845781245917;;;32;high;20.1.2014;;798;pcs;in-stock;;garden_tools;garden_tools;;false;;
Trubka teleskopická VP918x VP802x;Telescopic pipe VP918x VP802x;44290047;;8845781245918;<li>Typ trubice: Univerzální</li><br /><li>Prùmìr: 32mm</li>;<li> Tube type: Universal </ li> <br /> <li> Diameter: 32mm </ li>;299;high;13.2.2014;;54;pcs;in-stock;;garden_tools;garden_tools;;false;;
HEPA filtr VP-9711/12;HEPA filter VP-9711/12;44290050;8594049731732;8845781245919;;;269;high;10.1.2000;;78;pcs;in-stock;;garden_tools;garden_tools;;false;;
HEPA filtr Clipper VP-903/913;HEPA filter Clipper VP-903/913;44290173;8594049731695;8845781245920;;;199;high;1.2.2014;;8878;pcs;in-stock;;garden_tools;garden_tools;;false;;
NS-9510 Excelent náhradní sáèky papírové pro VP-9511/12/13;NS-9510replacement paper bags for VP-9511/12/13;ns9510;8594049730797;8845781245921;Náhradní papírové sáèky pro vysavaèe CONCEPT Excelent VP 9511/12/13. Balení: 5 ks sáèkù + vstupní filtr.;Spare paper bags for vacuum cleaners CONCEPT Excellent VP 9511/12/13. Packaging: 5 pieces of bags + input filter.;149;high;11.1.2000;;54;pcs;in-stock;;garden_tools;garden_tools;;false;;
Hnìtací háky - pár SR-3110;Moulding hooks – one pair SR-3110;42390017;;8845781245922;;;129;high;2.2.2014;;648;pcs;in-stock;;garden_tools;garden_tools;;false;;
HEPA filtr Futur VP-5020;HEPA filter Futur VP-5020;44291032;8594049731671;8845781245923;;;129;high;12.1.2000;;8744;pcs;in-stock;;garden_tools;garden_tools;;false;;
HEPA filtr Variant VP-5040;HEPA filter Variant VP-5040;44291087;8594049731688;8845781245924;;;199;high;23.1.2014;;648;pcs;in-stock;;garden_tools;garden_tools;;false;;
HEPA filtr Enzo VP-5030;HEPA filtre Enzo VP-5030;44291102;8594049731664;8845781245925;;;229;high;10.2.2014;;86;pcs;in-stock;;garden_tools;garden_tools;;false;;
Filtr vıstupní VP-5030;Output filter VP-5030;44291117;8594049731756;8845781245926;;;79;high;19.1.2014;;78;pcs;in-stock;;garden_tools;garden_tools;;false;;
NS-5040 Variant náhradní papírové sáèky pro VP-5040;NS-5040 Variant replacement paper bags for VP-5040;ns5040;8594049731626;8845781245927;Náhradní papírové sáèky pro vysavaèe CONCEPT Variant VP 5040. Balení: 5 ks sáèkù + vstupní a vıstupní filtr.;Spare paper bags for vacuum cleaners CONCEPT Variant VP 5040. Packaging: 5 pieces of bags + input and output filter.;119;high;5.1.2000;;878;pcs;in-stock;;garden_tools;garden_tools;;false;;
Koleèko pøední VP-9090;Front wheel VP-9090;44291327;;8845781245928;;;46;high;27.1.2014;;787;pcs;in-stock;;garden_tools;garden_tools;;false;;
TS-9140 náhradní sáèek textilní pro VP9141/VP9142 Clipper;TS-9140 textile replacement bag VP9141/VP9142 Clipper;ts9140;8594049739752;8845781245929;Náhradní textilní sáèek pro vysavaèe CONCEPT Clipper VP-9141. Balení: 1 ks;Replacement textile bag for vacuum cleaners CONCEPT Clipper VP-9141st Package: 1 pc;169;high;28.1.2014;;77;pcs;in-stock;;garden_tools;garden_tools;;false;;
Koleèko pøední VP914x VP813x;Front wheel VP914x VP813x;44291354;;8845781245930;;;46;high;29.1.2014;;7;pcs;in-stock;;garden_tools;garden_tools;;false;;
Trubky teleskopické kovové VP914x VP813x VP8230;Telescopic pipes metal VP914x VP813x VP8230;44291379;;8845781245931;<li>Typ trubky: Univerzální</li><br /><li>Délka: 86 cm</li><br /><li>Prùmìr: 32 mm</li>;<li> Pipe type: Universal </ li> <br /> <li> Length: 86 cm </ li> <br /> <li> Diameter: 32 mm </ li>;299;high;30.1.2014;;9;pcs;in-stock;;garden_tools;garden_tools;;false;;
CP-1001 STEAMER parní èistiè;Steam cleaner CP-1001 STEAMER;cp1001;8594049731039;8845781245932;<p>Parní èistiè CP-1001 STEAMER pøedstavuje ideální øešení pro odstraòování usazenıch mastnot, neèistot, špíny a vodního kamene. Ekologické èištìní bez chemickıch pøípravkù pomocí proudu páry. Parní èistiè je vybaven velmi bohatım pøíslušenstvím, které umoòuje parnímu èistièi opravdu široké uplatnìní.</p><br /><br /><h2>Dùvody, proè se rozhodnout právì pro parní èistiè  CP-1001 STEAMER:</h2><br /><br /><ol><li>Odstraòování neèistot párou je <strong>ekologické</strong>, protoe k nìmu nejsou tøeba ádné saponáty èi desinfekèní prostøedky.</li><br /><li>Èištìní parním èistièem <strong>Vám šetøí peníze</strong>, protoe spotøebováváte jen obyèejnou vodu, minimum elektrické energie a ádné èistící prostøedky.</li><br /><li>Èištìní je té <strong>šetrné k èištìnım materiálùm</strong>, protoe èištìné materiály nejsou vystaveny pùsobení agresivních èistících prostøedkù, které navíc mnohokrát zanechávají ve Vašem bytì nepøíjemnı zápach.</li><br /><li>Parní èistiè mùe pøispìt i ke zlepšení Vašeho zdravotního stavu, protoe jako jeden z mála èistících prostøedkù dokáe <strong>nièit alergeny</strong>, a to bez chemickıch pøípravkù.</li><br /><li><strong>Bohaté pøíslušenství</strong>, které je souèástí základní vıbavy parního èistièe CP-1001 STEAMER,  dodává parnímu èistièi opravdu široké vyuití. STEAMER pøedstavuje snadné èištìní rùznıch povrchù a v rùznıch úhlech: sklenìné povrchy, okna, zrcadla, koupelny, WC, døezy, baterie, èalounìní, podlahy èi pneumatiky aut a další). Mùete ho pouít pøi èištìní záclon a závìsù bez toho, ani byste je sundávali.</li><br /><li>Parní èistièe <strong>rozpouštìjí olej, mıdlo, mastnotu, špínu, zabíjí škodlivé bakterie</strong> a <strong>odstraòují zápach</strong>.</li><br /><li>Èištìní parním èistièem a jeho <strong>obsluha je velmi jednoduchá</strong>. Staèí nalít vodu, po cca 3 minutách ji èistiè promìní na vysokotlakovou páru a je pøipravenı na èištìní Vaší domácnosti.</li></ol><br /><br /><h2>Technické parametry:</h2><br /><br /><ul><li>Pøíkon: max. 1000 W</li><br /><li>Tlak: 3 bary</li><br /><li>Bohatı vıbìr pøíslušenství - 9 ks:</li><br /><li>hadice - pro lepší dostupnost ke zneèištìnému místu</li><br /><li>stìrka - na hladké povrchy</li><br /><li>parní rozptylovaè - pro èištìní vìtších ploch</li><br /><li>úhlovı nástavec - pro hùøe pøístupná místa</li><br /><li>odmìrka + nálevka - pro jednodušší nalévání</li><br /><li>koncentrovací tryska - pro èištìní spár a mezer</li><br /><li>èistící textilie - absorbuje neèistoty a lze prát</li><br /><li>detailovı kartáè - pro silnì zneèištìná místa</li><br /><li>Extra dlouhı pøívodní kabel 5 m</li><br /><li>Bezpeènostní ventil</li><br /><li>Svìtelná kontrolka</li><br /><li>Napìtí: 230 V</li></ul><br /><br />;<p> Steam Cleaner CP-1001 STEAMER is ideal for removing debris grease, dirt, grime and scale. Ecological cleaning without chemical plant with a jet of steam. Steam Cleaner features a rich accessory that allows steam cleaners very wide application. </ P> <br /> <br /> <h2> Reasons to opt just for a steam cleaner CP-1001 STEAMER: </ h2> < br /> <br /> <ol> <li> Removing impurities steam is <strong> eco </ strong> because it requires no detergents or disinfectants. </ li> <br /> <li> Clean steam Cleaner <strong> saves you money </ strong>, because they use just plain water, minimal electricity, and no detergents. </ li> <br /> <li> Cleaning is also <strong> cleaned friendly materials </ strong > because purified materials are not exposed to aggressive cleaning agents, which also often leave your home an unpleasant odor. </ li> <br /> <li> Steam cleaners can also help to improve your health, because one of the few cleaning funds can <strong> destroy allergens </ strong>, without chemicals. </ li> <br /> <li> <strong> Comprehensive accessories </ strong>, which is fitted as standard steam cleaner CP-1001 STEAMER adds steam cleaner really wide range of applications. STEAMER is the easy cleaning of different surfaces and in different angles: glass surfaces, windows, mirrors, bathrooms, toilets, sinks, batteries, upholstery, floors or car tires, etc.). You can use it for cleaning curtains and draperies without without you strip off. </ Li> <br /> <li> Steam cleaners <strong> dissolve oil, soap, grease, dirt, kills harmful bacteria </ strong> and < strong> remove odor </ strong>. </ li> <br /> <li> Cleaning steam cleaner and <strong> Operation is very simple </ strong>. Just pour the water after about 3 minutes it turns into a high-pressure cleaner steam and is ready to clean your home. </ Li> </ ol> <br /> <br /> <h2> Specifications: </ h2> <br /> <br /> <ul> <li> Power consumption: max. 1000 W </ li> <br /> <li> Pressure: 3 bar </ li> <br /> <li> rich selection of accessories - 9 pieces </ li> <br /> <li> hose - for better accessibility to the contaminated spot </ li> <br /> <li> trowel - on smooth surfaces </ li> <br /> <li> Steam diffuser - for cleaning larger surfaces </ li> <br /> <li> angled adapter - for less accessible places </ li> <br /> <li> + scoop funnel - for easy pouring </ li> <br /> <li > koncentrovací nozzle - for the cleaning of joints and gaps </ li> <br /> <li> cleaning cloth - absorbs dirt and washable </ li> <br /> <li> details of brush - for heavily soiled areas </ li> <br /> <li> Extra long power cord 5 m </ li> <br /> <li> The safety valve </ li> <br /> <li> The indicator light </ li> <br /> <li> Voltage: 230 V </ li> </ ul> <br />;1499;high;26.1.2014;;78;pcs;in-stock;;garden_tools;garden_tools;;false;;
