name_cs;name_en;catnum;partno;ean;description_cs;description_en;price;vat;sellingFrom;sellingTo;stockQuantity;unit;availability;parameters;categories1;categories2;flags;sellingDenied;brand;mainVariantCatnum
DeLonghi ECAM 44.660 B Eletta Plus;DeLonghi ECAM 44.660 B Eletta Plus;9771339;ECAM 44.660 B;8845781245934;DeLonghi ECAM 44.660 B Luxusní plnoautomatickı kávovar Eletta Plus v èerné barvì s nerezovımi èástmi,1450 W;"<h2>DéLonghi ECAM 44.660.B</h2><div id=""flix"" class=""clearRight""></div><div id=""cpcm_cpc_mediaDescription""><div id=""desc""><div style=""min-height: 0px;"" class=""lazyDescription"" id=""descAnnotation"" data-code=""EAN3019p""><div style=""width: 100%; display: inline;""><p>Start the morning with your favorite drink with the DeLonghi ECAM 44.660.B Eletta automatic coffee maker.&nbsp; A built in special hot steam/water jet automatically prepares a thick milk froth for cappuccino and tea. Drip coffee lovers can also press their own coffee.</p><h3>Magic Milk Menu button</h3><p><br>A special function is the Milk Menu button, which gives you a choice of milk-based beverages. In addition to the classic cappuccino, latte macchiato, or Latte, you can prepare rare drinks such as Espresso macchiato and a flat white. For a quick and easy treat, you can prepare hot cocoa or a cup of frothed milk, and the size of the beverage can be adjusted based on the cup.&nbsp;&nbsp;</p>";19743.6;high;20.1.2014;;140;pcs;in-stock;"[cs:Tlak,en:Pressure]=[cs:15 bar,en:15 bar];[cs:Objem zásobníku na vodu,en:Water reservoir capacity]=[cs:2 l,en:2 l];[cs:Objem zásobníku na mléko,en:Milk reservoir capacity]=[cs:600 ml,en:600 ml];[cs:Kapacita zásobníku na zrna,en:Magazine capacity for beans]=[cs:400 g,en:400 g]";coffee;coffee;new;false;delonghi;
Drák na hrnce, èernı;Drák na hrnce, èernı;5962199;;8845781245958;V kuchyni se Vám urèitì ji nìkolikrát stalo, e jste si potøebovali nìkam odloit hrnec a najednou nebylo kam. Díky tomuto dráku na hrnce ve tvaru postavièky se Vám to ji nikdy nestane. Konec nemotornému odkládání hrncù na novou kuchyòskou linku nebo na prkénko urèené ke krájení zeleniny. Usnadnìte tímto dárkem partnerovi vaøení.;This pot holder is used to hold pots. No more burnt kitchen tables!;3;high;13.2.2014;;;pcs;out-of-stock;;books;books;new;true;;
Genius NetScroll 310 støíbrná;Genius NetScroll 310 støíbrná;5960139;31011039100;8845781245924;myš optická, konektor USB, 1200dpi, vhodná pro notebooky;Simple Genius Mouse NetScroll 310 offers the most widely used functional elements of a basic ergonomics. It has an optical sensor with a resolution of 800 DPI, which can handle work on a large number of standard surfaces. There are two classic buttons and the third with the paging function wheel. Genius NetScroll 310 is equipped with modern USB interface and finds use in conserving ambidextrous or in an office environment. <br><br><strong> Specifications: </strong><br><br><strong> Supported OS: </strong><br> Microsoft Windows 7, Vista, XP, 2003, 2000, 98SE <br> Mac OS 8.6 or later ;90.1;high;10.1.2000;;300;pcs;in-stock;[cs:Technologie,en:Technology]=[cs:Optická,en:Optical],[cs:Rozhraní,en:Interface]=[cs:Drátová,en:Wired];pc;pc;action;false;genius;
Genius repro SP-M120 èerná;Genius repro SP-M120 èerná;5960550;31730946108;8845781245946;Jednopásmové stereo reproduktory SP-M120 s celkovım hudebním vıkonem 2 W, èernım lesklım povrchem a elegantním kovovım krytem. Pøední panel obsahuje 2 ovládací prvky (ovládání hlasitosti, zapnutí/vypnutí) a vıstup pro sluchátka.;"<h2>GENIUS SP-M120 black</h2><div id=""flix"" class=""clearRight""></div><div id=""cpcm_cpc_mediaDescription""><div id=""desc""><div style=""min-height: 0px;"" class=""lazyDescription"" id=""descAnnotation"" data-code=""JG007a""><div style=""width: 100%; display: inline;""><p align=""justify""> Sleek and compact stereo speakers in combination of black and metallic surface. Speakers provide basic computer sound system with an output of 2 W RMS. On the front is virtually placed in a large volume control, but not forgotten even the popular headphone jack. <br><br><strong> Specifications: <br><br> Performance: <br></strong> 2 x 1 W RMS <br><br><strong> Frequency Range: <br></strong> 100 Hz - 20KHz <br><br><strong> Signal/noise ratio: <br></strong> 75 db <br><br><strong> Dimensions: <br></strong> 50 x 90 mm </p>";164.5;high;1.2.2014;;220;pcs;in-stock;"[cs:Typ soustavy,en:System type]=[cs:2.0,en:2.0];[cs:Aktivní/Pasivní,en:Active/Passive]=[cs:Aktivní,en:Active];[cs:Celkovı vıkon,en:Overall performance]=[cs:2 W,en:2W]";"tv;pc";tv;new;false;genius;
Genius SlimStar i820;Genius SlimStar i820;5960549;31340021118;8845781245925;klávesnice s myší, bezdrátová, ultratenká, nano pøijímaè s konektorem USB, s bezdrátovou optickou myší s turborolováním, dosah a 10m, klávesnice obsahuje èeské znaky;"<h2>Genius SlimStar i222 CZ+SK Black</h2><div id=""flix"" class=""clearRight""></div><div id=""cpcm_cpc_mediaDescription""><div id=""desc""><div style=""min-height: 0px;"" class=""lazyDescription"" id=""descAnnotation"" data-ode=""ME300l3""><div style=""width: 100%; display: inline;""><p>GENIUS LuxeMate I222 is a stylish black keyboard, which at first glance invites you to use your Apple design. It will decorate your desk at home or in the office. In addition to the standard layout will delight and a large variety of function keys that enhance control of the internet, email and also a multimedia player. Low profile you use for long periods still feel comfortable. The computer keyboard GENIUS LuxeMate I222 connects via USB interface.<br><br><strong>Specifications:<br><br>Type: </strong><br>conduction<br><br><strong>Layout: </strong><br>Czech<br><br><strong>Interface: </strong><br>USB<br><br><strong>Design:</strong><br>Apple design";437.2;high;11.1.2000;;100;pcs;in-stock;"[cs:Lokalizace,en:Localization]=[cs:èeská,en:Czech];[cs:Uspoøádání prvkù,en:Element arrangement]=[cs:klasické,en:classic];[cs:Enter,en:Enter]=[cs:jednoøádkovı,en:one-slotted]";pc;pc;;false;genius;
Genius SP-U150X èernozelené;Genius SP-U150X èernozelené;8456655;31730992101;8845781245947;REPRO Genius SP-U150X èernozelené 4W 2.0;"<h2>Genius SP-HF150 Black</h2><div id=""flix"" class=""clearRight""></div><div id=""cpcm_cpc_mediaDescription""><div id=""desc""><div style=""min-height: 0px;"" class=""lazyDescription"" id=""descAnnotation"" data-code=""JG015h2""><div style=""width: 100%; display: inline;""> Compact Speakers Genius SP-HF150 are the perfect accessory for portable computers. It is powered only by the USB port. Yet they can generate high power 4 W RMS. The sound of the smaller 2.5 ""drives is airy, yet does not lack sufficient bass fundament. All of the elegant veneer finish imitating a hidden volume control. <br><strong><br> Specifications: </strong><br><br><strong> Sound characteristics: </strong><br> Power: 2 x 2 W RMS <br> Drivers: 2.5 ""(širokpásmové) <br> Frequency range: 200 to 20 000 Hz <br> Signal-to-Noise Ratio: 70 db <br><br><strong> Connectors: </strong><br> 3.5 mm audio <br> USB for power";180;high;2.2.2014;;220;pcs;in-stock;"[cs:Typ soustavy,en:System type]=[cs:2.0,en:2.0];[cs:Aktivní/Pasivní,en:Active/Passive]=[cs:Aktivní,en:Active];[cs:Celkovı vıkon,en:Overall performance]=[cs:2 W,en:2W]";"tv;pc";tv;new;false;genius;
GIGABYTE KM7580 CZ;GIGABYTE KM7580 CZ;5960598;GK-KM7580;8845781245926;klávesnice s myší, multimediální, bezdrátová rádiová 2.4GHz, nano pøijímaè na USB, 15 multimediálních kláves, dosah a 5m, napájení klávesnice a myši 4x AAA, hmotnost 518 a 60 gramù, klávesnice obsahuje èeské znaky;"<h2>GIGABYTE GK-KM7580 Black</h2><div id=""flix"" class=""clearRight""></div><div id=""cpcm_cpc_mediaDescription""><div id=""desc""><div style=""min-height: 0px;"" class=""lazyDescription"" id=""descAnnotation"" data-code=""EG870h""><div style=""width: 100%; display: inline;""><p align=""justify""> Quality set keyboard and optical mouse from Gigabyte. Both components are color-matched to the sleek glossy black color. The keyboard has 15 multimedia keys for quick access to the Internet, email and other applications. The multimedia keys also used for various tasks (volume control, ...). Optical mouse has a sensor with a resolution of 500 to 1000 DPI resolution can be switched. Mouse fits both the left and the right hand. Wireless communication provides a miniature USB receiver for keyboard and mouse. This set will contrast nicely on any desk. <br><br><strong> Specifications: </strong> <br><br><strong> Multimedia keys: </strong><br> 15 hotkeys <br><br><strong> Interface: </strong><br> USB receiver <br><br><strong> Communication: </strong><br> wireless, 2.4 GHz band <br><br><strong> Power: </strong><br> Keyboard: 2x AAA <br> Mouse: 2x AAA";429.8;high;12.1.2000;;80;pcs;in-stock;"[cs:Lokalizace,en:Localization]=[cs:èeská,en:Czech];[cs:Uspoøádání prvkù,en:Element arrangement]=[cs:klasické,en:classic];[cs:Enter,en:Enter]=[cs:jednoøádkovı,en:one-slotted]";pc;pc;;true;gigabyte;
HP Deskjet Ink Advantage 1515 (B2L57C);HP Deskjet Ink Advantage 1515 (B2L57C);718254;B2L57C;8845781245937;S touto jednoduchou a cenovì dostupnou multifunkèní tiskárnou HP Deskjet mùete tisknout, skenovat i kopírovat. Tisknìte více za ménì penìz s levnımi inkousty. Ušetøete místo díky kompaktnímu provedení, které lze umístit kamkoli, a zaènìte pracovat bìhem pár okamikù díky rychlé a jednoduché instalaci. ;"<p>Hewlett-Packard was founded in the difficult times of the Great Depression. The founders were a pair of friends whose name the company still proudly bears. They started their business in an unobtrusive garage near the city of Palo Alto. It is now a national monument. HP’s success lay not in copying existing products, but in the ability and courage to come up with something new.</p><p>The first commercial triumph was an oscillator that surpassed all competition in quality, yet sold at a quarter of the price. In 1968, HP released their first desktop computer - a desktop calculator. The company currently manufactures products primarily related to computer technology - computers and laptops, printers, scanners, digital cameras, servers, and last but not least, calculators.</p><div class=""clear""></div></div><div><div class=""bottomTitle"">Note:</div><div class=""bottom""><p><span style=""font-family: Verdana, sans-serif, Arial; font-size: small; line-height: 19.5px;"">Unless otherwise indicated in the product description, packaging does not contain a USB interface cable.</span></p>";1238;high;23.1.2014;;;pcs;in-stock;"[cs:Technologie tisku,en:Print technology]=[cs:inkoustové,en:inkjet];[cs:Maximální formát]=[cs:A3];[cs:LCD]=[cs:Ne];[cs:Rozlišení tisku,en:Print resolution]=[cs:2400x600,en:2400x600];[cs:Barevnı tisk]=[cs:Ano];[cs:USB]=[cs:Ano];[cs:WiFi,en:WiFi]=[cs:Ano,en:Yes];[cs:Hmotnost]=[cs:3.5 kg];[cs:Rozmìry]=[cs:449x304x152 mm]";printers;printers;new;false;hp;
HTC Desire 816 White;HTC Desire 816 White;9511043;99HZS017;8845781245955;Fotografùv sen. Hlavní fotoaparát s 13 megapixely a pøední fotoaparát s 5 megapixely zaruèují fotky ve vysokém rozlišení z kadé strany. Díky vestavìnım nástrojùm pro úpravu a sdílení mùete zachytit pohyblivé obrázky v HD kvalitì a kombinovat vısledky do zobrazení z více úhlù. Neuvìøitelnı design, obøí 5,5palcovı displej s HD rozlišením, dva pøední stereo reproduktory, pøizpùsobené kanály s informacemi v reálném èase a ètyøjádrovı procesor – to vše dohromady tvoøí jeden z nejvıhodnìjších smartphonù na svìtì.;"Špièkovı smartphone HTC Desire 816 v elegantní bílé pastelové barvì je urèen pro milovníky velkıch displejù. Telefonu dominuje kapacitní dotykovı Super LCD displej s úhlopøíèkou 5,5"" a rozlišením 1280x720 pixelù. Díky nìmu mùete pohodlnì prohlíet fotografie, pøehrávat videa nebo surfovat na internetu. I pøes vetší rozmìry vırobce zachoval pøíjemnou hmotnost 165 g.";8421.5;high;10.2.2014;;;pcs;out-of-stock;"[cs:Úhlopøíèka displeje,en:Display Size]=[cs:5.5"",en:5.5""];[cs:Typ displeje,en:Display type]=[cs:Super LCD,en:Super LCD];[cs:Rozlišení standardní zadní kamery,en:Resolution of rear camera]=[cs:13 Mpx,en:13 Mpx]";phones;phones;"new;top";false;htc;
JURA Impressa J9 TFT Carbon;JURA Impressa J9 TFT Carbon;9772572;JURA Impressa J9 TFT Carbon;8845781245933;JURA Impressa J9 TFT Carbon Automatickı kávovar/espresso,barevnı LCD;"<h2>JURA IMPRESSA Z9 One Touch TFT Pianoblack</h2><div id=""flix"" class=""clearRight""></div><div id=""cpcm_cpc_mediaDescription""><div id=""desc""><div style=""min-height: 0px;"" class=""lazyDescription"" id=""descAnnotation"" data-code=""JURES003""><div style=""width: 100%; display: inline;""><p> Luxury automatic coffee machine Jura Impressa Z9 One Touch packed with Swiss precision and elegance, which sets new standards. This machine brings you jeich on several levels, such as coffee quality, easy to use and attractive design. The purpose is always the most advanced technology to achieve real, authentic results. The powerful device has intuitive controls and except large 3.5 ""TFT color display. Together with rotary dial allows you to choose between 11 specialties and goes to prepare any coffee you can think of. With the coffee a la carte, allowing you to quickly change settings according to your needs, your options are almost limitless. </p><p> For an authentic experience and to ensure optimal conditions for coffee are two Thermoblocks. The first coffee and hot water, the second is intended to couple. With every cup of coffee is also possible to set the correct brewing temperature, amount of water and grind. Mill technology + Aroma is quiet and up to twice faster than previously used. Grains of coffee while grinding so much heat and so there is no negative influence of taste of coffee. </p><p> Foam crown in drinks Latte macchiato, cappuccino and other specialty are the world extremely popular. Automatic coffee machine in the model IMPRESSA Z9 One Touch is a distinctive design with a combination of pure luxury and sophistication. But technology also has a soft foam that each of trendy coffee specialties will adjust fluffy crown. S cappuccino outlets, which can be adjusted up to 153 mm, there is no problem to use a glass or a latte macchiato. Formed with Swiss precision and elegance with which you prepare the perfect espresso, cappuccino or caffe latte. </p><p> You will enjoy a very low power consumption. If the espresso is separated from the mains power switch, patented innovation JURY Zero Energy Switch (zero energy consumption) will remove any energy at all. Before turning off the espresso is automatically purged and cleansed, which provides him with long life. The unique geometry with finer teeth grinding and new technology supports the lower noise machine when grinding coffee. </p>";49587.5;high;19.1.2014;;111;pcs;in-stock;"[cs:Tlak,en:Pressure]=[cs:15 bar,en:15 bar];[cs:Objem zásobníku na vodu,en:Water reservoir capacity]=[cs:2 l,en:2 l];[cs:Objem zásobníku na mléko,en:Milk reservoir capacity]=[cs:600 ml,en:600 ml];[cs:Kapacita zásobníku na zrna,en:Magazine capacity for beans]=[cs:400 g,en:400 g]";coffee;coffee;new;false;jura;
Kabel HDMI A - HDMI A M/M 2m zlacene konektory High Speed HD;Kabel HDMI A - HDMI A M/M 2m zlacene konektory High Speed HD;2565636;0;8845781245919;Kabel HDMI A - HDMI A M/M 2m zlacene konektory High Speed HDMI kabel s Ethernetem 1.4 podpora 1080p FULL HD;Kabel - zlacené konektory, podpora ethernet (1.4);98;high;5.1.2000;;150;pcs;in-stock;;pc;pc;;false;;
Kniha 55 nejlepších programù pro vypalování CD a DVD;Kniha 55 nejlepších programù pro vypalování CD a DVD;9890478;9788025117125;8845781245941;Existují stovky programù pro vypalování, avšak vyznat se v nich není ani pro zkušeného uivatele vùbec jednoduché. Právì proto jsme pro vás s autorem èeskıch bestsellerù pøipravili 2. aktualizované vydání této úspìšné publikace. S knihou získáte nejen prùvodce nejrùznìjším vypalováním na CD a DVD, ale všechny programy a aplikace si mùete okamitì vyzkoušet, nebo je obsahuje pøiloené DVD.;"<p><strong>CD/DVD/Blu-ray/HD-DVD</strong>is an affordable program for burning CD/DVD/Blu-ray/HD-DVD media. Intuitive operation with its easy to handle even a novice in this field. Another big advantage is the use of technology burning ""on the fly"", which is spared not only your time but also the capacity of the disk, because the process does not create any storage (temporary) files on your hard disk.<br><br>Worth mentioning is also the fact that<strong> for its operation baking does not use any components of Windows</strong> or other manufacturers. Its functionality is not needed any external libraries or DLL. This makes the software provides high stability, even if your system is corrupted Windows. <strong>This gives you the ability to backup before reinstalling Broken System</strong>. <span style=""font-size: 13px;"">The program is completely in the Czech language.</span></p>";37;high;27.1.2014;;500;pcs;in-stock;"[cs:Poèet stránek,en:Pages count]=[cs:55,en:55];[cs:Hmotnost,en:Weight]=[cs:50 g,en:50 g];[cs:Pøebal,en:Cover]=[cs:pevnı,en:hardcover]";books;"pc;books";new;false;;
Kniha Bodovı systém a pravidla silnièního provozu;Kniha Bodovı systém a pravidla silnièního provozu;9831504;9788072267361;8845781245942;Prostudujte si nová pravidla silnièního provozu platná od 1. èervence 2006! ;New driving rules and tips just for you!;37;high;28.1.2014;;100;pcs;in-stock;"[cs:Poèet stránek,en:Pages count]=[cs:50,en:50];[cs:Hmotnost,en:Weight]=[cs:150 g,en:150 g];[cs:Pøebal,en:Cover]=[cs:papír,en:paper]";books;books;new;false;;
Kniha Jak na poèítaè Digitální fotografie II;Kniha Jak na poèítaè Digitální fotografie II;9890274;9788025107805;8845781245943;Máte ji za sebou první krùèky s digitálním fotoaparátem? Chcete proniknout do tajemství pìknıch snímkù? V této kníeèce se dozvíte, na co si dát pøed zmáèknutím spouštì pozor, aby vaše fotografie netrpìla typickımi chybami zaèáteèníkù, jak se fotografují rùzné typy objektù (portrét, krajina, mometky aj.) a jak snímky doladit v poèítaèi, aby vıslednı dojem byl dokonalı.;Discover the secret of people with us.;44;high;29.1.2014;;450;pcs;in-stock;"[cs:Poèet stránek,en:Pages count]=[cs:250,en:250];[cs:Hmotnost,en:Weight]=[cs:250 g,en:250 g];[cs:Pøebal,en:Cover]=[cs:papír,en:paper]";books;books;new;false;;
Kniha Køemílek a Vochomùrka;Kniha Køemílek a Vochomùrka;9197872;9788000026336;8845781245944;Prohlíejte obrázky a vyprávìjte si s dìtmi pøíbìhy veselıch muíèkù, Køemílka a Vochomùrky! Leporelo s ilustracemi Zdeòka Smetany a texty podle kníky V. Ètvrtka potìší nejen dìti, ale jejich rodièe a prarodièe.;Collection of classical Czech fairy tales.;56;high;30.1.2014;;650;pcs;in-stock;"[cs:Poèet stránek,en:Pages count]=[cs:48,en:48];[cs:Hmotnost,en:Weight]=[cs:50 g,en:50 g];[cs:Pøebal,en:Cover]=[cs:papír,en:paper]";books;books;new;false;;
Kniha Postup pøí zvládání dopravní nehody;Kniha Postup pøí zvládání dopravní nehody;9198277;9788025133484;8845781245940;Karta je vyrobena z odolného materiálu a obsahuje pøehlednı návod na poskytnutí první pomoci. Prostøednictvím jednoduchıch obrázkù a vıstinıch textù názornì popisuje, jak má zachránce poskytnout první pomoc zranìnım osobám pøi dopravní nehodì. Karta obsahuje informace potøebné pro zastavení krvácení, uvolnìní dıchacích cest, masá srdce, dıchání z úst do úst a uloení zranìného do stabilizované polohy.;Have you ever experienced an accident and didn't know how to react? Or are you going to? This book is just for you!;28;high;26.1.2014;;200;pcs;in-stock;;books;books;new;false;;
LG E410 Optimus L1 II White;LG E410 Optimus L1 II White;8981018;8808992086758;8845781245951;Model LG E410 Optimus L1 II zaujme uivatele elegatním vzhledem øady L style a praktickou velikostí. Optimus L1 II nabízí kapacitní TFT LCD displej s úhlopøíèkou 3 palce a monosti zobrazení 262 tisíc barev v rozlišení 240 × 320 pixelù. Za zmínku stojí také interní pamì. Pro uivatelská data slouí interní úloistì s kapacitou 4GB, které je moné rozšíøit pomocí microSDHC karet a do veliskoti 32GB. Lákadlem pro bìné uivatele je digitální fotoaparát o rozlišení 2MPx, s moností záznamu VGA videa. Mobil je pohánìn jednojádrovım procesorem Qualcomm MSM7225A o frekvenci 1GHz, operaèní pamìtí 512MB RAM a grafickım èipem Adreno 200. Operaèní systém je Google Android ve verzi 4.1 Jelly Bean, kterı nabízí mnoho funkcí èi v základu pøedinstalovanıch aplikací. Model E410 zaujme také podporou sociálních sítí, a GPS navigace. Nechybí zde také rychlé datové pøenosy Wi-Fi, GPRS, EDGE, BlueTooth a pro synchronizaci s PC lze vyuít microUSB konektor. Aktivní posluchaèi hudby ocení audio konektor 3,5mm, díky kterému mohou pøipojit svá oblíbená sluchátka.  ;"Mobile phone 4.7"" 720x1280, procesor 1,5GHz, internal memory 16GB, camera 8mpx, GPS, WiFi, Bluetooth, 3G, FM, microSD, micro USB, Android 4.0";1644;high;6.2.2014;;440;pcs;on-request;"[cs:Hmotnost]=[cs:112g];[cs:Rozmìry,en:Dimensions]=[cs:123.8x58.6x7.6mm,en:123.8x58.6 mm];[cs:Monost pamìtové karty]=[cs:Ne];[cs:Pamì RAM]=[cs:1024 MB];[cs:Poèet barev]=[cs:16mil.];[cs:Frekvence procesoru]=[cs:1.7GHz];[cs:Poèet jader procesoru]=[cs:2];[cs:Bluetooth]=[cs:Ano];[cs:NFC]=[cs:Ne];[cs:GPS modul]=[cs:Ne]";phones;phones;new;false;lg;
Logitech S120 black;Logitech S120 black;9680315;980-000010;8845781245949;Standardní sterefonní reproduktory, které jsou svou velikostí vhodné napø. k notebookùm.;"<h2>Logitech S-120 Speaker System</h2><div id=""flix"" class=""clearRight""></div><div id=""cpcm_cpc_mediaDescription""><div id=""desc""><div style=""min-height: 0px;"" class=""lazyDescription"" id=""descAnnotation"" data-code=""JL083""><div style=""width: 100%; display: inline;""> Modern stereo speakers in a stylish black design, with an output of 2.3 W, suitable only for desktops and laptops, but also for CD or MP3 players, and other devices diskmanùm. They are connected via standard stereo jack 3,5 mm. The speakers have a frequency response of 50 Hz to 20 kHz. Easily accessible controls are located on the side of the right speaker with headphone outlet. <br><br><b> Specifications: </b><br><strong><br> Performance: <br></strong> 2.3 W (2 x 1.15 W RMS) <br><br><strong> Frequency response: <br></strong> 50 Hz to 20 kHz <br>";263.6;high;4.2.2014;;200;pcs;on-request;"[cs:Typ soustavy,en:System type]=[cs:2.0,en:2.0];[cs:Aktivní/Pasivní,en:Active/Passive]=[cs:Aktivní,en:Active];[cs:Celkovı vıkon,en:Overall performance]=[cs:2 W,en:2W]";"tv;pc";tv;new;false;logitech;
Microsoft Basic Optical Mouse, èerná;Microsoft Basic Optical Mouse, èerná;5960072;P58-00059;8845781245922;Tato USB myš funguje spolehlivì na témìø libovolném povrchu a je uzpùsobená pro ovládání pravou i levou rukou.;Practical and stylish optical mouse ideal for everyday office use.With its ergonomic shape fits perfect and is suitable for left and for right-handers.Using an optical sensor with high sensitivity is move the cursor on the screen fast and smooth.Benefits are also programmable buttons to help with easy access to the programs and documents you use most often.The computer mouse simply connect using a cable with a USB connector and the support Plug and Play, no need to install drivers and you can immediately get to work. ;231.5;high;8.1.2000;;400;pcs;in-stock;"[cs:Herní myš]=[cs:Ano];[cs:Ergonomie]=[cs:Pravoruká];[cs:Podporovanı OS]=[cs:Windows 2000/XP/Vista/7];[cs:Poèet tlaèítek]=[cs:5]";pc;pc;;true;microsoft;
Milionovı toaleák euro;Milionovı toaleák euro;5961383;6932011296018;8845781245959;toaleák s potiskem bankovek EURO, pocit z pouití tohoto toaletního papíru dá zapomenout na jakékoliv trable spojené s finanèní krizí;Toilet paper with Euro pictures. Even you can feel rich now!;10;high;14.2.2014;;;pcs;out-of-stock;;books;books;"new;action;top";false;;
"MIO Cyclo 100, cyklopoèítaè na jízdní kolo, 1,8""";"MIO Cyclo 100, cyklopoèítaè na jízdní kolo, 1,8""";;;8845781245916;"Cyklocomputer - cyklonavigace s pøedinstalovanımi mapami silnic a cyklotras, barevnı dotykovı displej 3"", pøedinstalované body zájmu, vodotìsnost (IPX7), bezdrátovı pøenos ANT+, tréninkové programy, spravování dat pomocí aplikace Mio Share, snímaè rychlosti a kadence, monitor srdeèního tepu, WiFi ";"Cyklocomputer – cyklonavigation with preset maps, color display 3"", training programmes, WiFi";0;high;2.1.2000;;200;pcs;in-stock;;pc;pc;;false;;
OKI MC861cdxn+ (01318206);OKI MC861cdxn+ (01318206);8980686;1318206;8845781245935;OKI MC861cdxn+, barevná A3 34/26 ppm ProQ2400 dpi PCL/PS,USB 2.0,LPT,LAN (Print/Scan/Copy/Fax) - MC861cdxn+ - duplexní jednotka, síová karta, 2. a 3. zásobník, nízkı kabinet;Toner for MC861/ 851, 7000 pages;67771.9;high;21.1.2014;;200;pcs;in-stock;"[cs:Technologie tisku,en:Print technology]=[cs:inkoustové,en:inkjet];[cs:Maximální formát]=[cs:A3];[cs:LCD]=[cs:Ano];[cs:Rozlišení tisku,en:Print resolution]=[cs:4800x1200,en:4800x1200];[cs:Barevnı tisk]=[cs:Ano];[cs:USB]=[cs:Ano];[cs:WiFi,en:WiFi]=[cs:Ne,en:No];[cs:Rozmìry,en:Dimensions]=[cs:426x306x145 mm,en:426x306x145 mm];[cs:Hmotnost]=[cs:3.5 kg]";printers;printers;new;false;;
