name_cs;name_en;catnum;partno;ean;description_cs;description_en;price;vat;sellingFrom;sellingTo;stockQuantity;unit;availability;parameters;categories1;categories2;flags;sellingDenied;brand;mainVariantCatnum
"22"" Sencor SLE 22F46DM4 HELLO KITTY";"22"" Sencor SLE 22F46DM4 HELLO KITTY";9177759;SLE 22F46DM4;8845781245930;"<p><strong>Sencor SLE 22F46DM4 Hello Kitty je televizor LED pro ty, kteøí hledají pro své dìti nìco, co mají rádi a co by je potìšilo . Televizor s motivy populární Hello Kity a provedením v rùové barvì vaše dítko urèitì zaujme!</strong></p>  <p><img alt="""" src=""https://interlink-static0.tsbohemia.cz/22-sencor-sle-22f46dm4-hello-kitty_ien157376.jpg"" style=""height:300px; width:300px"" /></p>  <ul>  <li>Úhlopøíèka 55 cm (21,5&quot;)</li>  <li>LED podsvícení displeje</li>  <li>Integrovanı DVD/DivX pøehrávaè</li>  <li>Nahrávání na USB disk (formát TS) / pøehrávání z USB disku (PVR)</li>  <li>Timeshift (èasovı posun)</li>  <li>rozlišení displeje 1920x1080 bodù</li>  <li>Vestavìnı HD DVB-T/C MPEG4 tuner</li>  <li>USB port (pøehrávání z externího disku)</li><li> Pøipojení: HDMI, SCART, AV vstup, YPbPr, VGA kabel, PC Audio vstup, USB 2.0</li> </ul>  <p><em>Podporované formáty: DivX, XviD, MP3,WMA, JPEG </em></p>  <p>Kontrast 1000:1 Jas 250 cd/m2 Rychlost odezvy 5 ms Progressive Scan PAL, SECAM BG/DK/A2/NICAM, AV vstup i NTSC 4,43 Širokı pozorovací úhel 170&deg;/160&deg; Elektronickı programovı prùvodce (EPG) Teletext Vícejazyèné menu Obvody pro zlepšení obrazu (DNR) Digitální høebenovı filtr (DCF 3D) AVL ZOOM Ekvalizér Hodiny Èasovaè vypnutí Dìtská pojistka Jednoduchı hotelovı mód. Sencor SLE 22F46DM4 Hello Kitty je televizor LED pro ty, kteøí hledají pro své dìti nìco, co mají rádi a co by je potìšilo . Televizor s motivy populární Hello Kity a provedením v rùové barvì vaše dítko urèitì zaujme! LED televize Sencor SLE 22F46DM4 HELLO KITTY LED Full HD televizor Úhlopøíèka 55 cm (21,5&quot;) LED podsvícení displeje Integrovanı DVD/DivX pøehrávaè Nahrávání na USB disk (formát TS) / pøehrávání z USB disku (PVR) Timeshift (èasovı posun) na pøipojenı USB disk Full HD rozlišení displeje 1920x1080 bodù Vestavìnı HD DVB-T/C MPEG4 tuner USB port (pøehrávání z externího disku) Podporované formáty: DivX, XviD, MP3,WMA, JPEG Kontrast 1000:1 Jas 250 cd/m2 Rychlost odezvy 5 ms Progressive Scan PAL, SECAM BG/DK/A2/NICAM, AV vstup i NTSC 4,43 Širokı pozorovací úhel 170&deg;/160&deg; Elektronickı programovı prùvodce (EPG) Teletext Vícejazyèné menu Obvody pro zlepšení obrazu (DNR) Digitální høebenovı filtr (DCF 3D) AVL ZOOM Ekvalizér Hodiny Èasovaè vypnutí Dìtská pojistka Jednoduchı hotelovı mód</p>  <p>&nbsp;</p> ";Television LED, 55 cm diagonal, 1920x1080 Full HD, DVB-T MPEG4 tuner with USB recording and playback (DivX, XviD, MP3, WMA, JPEG), HDMI, SCART, VGA, pink execution, energ. Class B;2891.7;high;16.1.2000;;300;pcs;in-stock;"[cs:Úhlopøíèka,en:Screen size]=[cs:27"",en:27""];[cs:Technologie]=[cs:LED];[cs:Rozlišení,en:Resolution]=[cs:1920×1080 (Full HD),en:1920×1080 (Full HD)];[cs:USB,en:USB]=[cs:Ano,en:No];[cs:HDMI]=[cs:Ano]";tv;"tv;books";"top;action";false;sencor;
"32"" Philips 32PFL4308";"32"" Philips 32PFL4308";9176508;32PFL4308H;8845781245929;"<p><img alt="""" src=""http://img.talkandroid.com/uploads/2014/03/phillips_logo.jpg"" style=""height:150px; width:400px"" /></p>  <h1><span style=""color:#0000CD"">Televize PHILIPS 32PFL4308 3D LED TV 4300 series&nbsp;</span></h1>  <ul>  <li>32&quot;(81 cm)</li>  <li>Full HD</li>  <li>200PMR</li>  <li>DVB-T/C&nbsp;</li>  <li>HDMI</li>  <li>USB</li>  <li>Full HD LED TV</li> </ul>  <h2>Na kvalitì obrazu záleí.&nbsp;</h2>  <p>Obyèejné televizory HDTV pøinášejí kvalitu,ale vy oèekáváte to nejlepší. Pøedstavte si úchvatnì ostré detaily ve spojení s vysokım jasem,neuvìøitelnım kontrastem,ostrım vykreslením pohybu,realistickımi barvami a vìrnım obrazem - a také se sníenou spotøebou energie. Tak u nemusíte dále hledat. Televizor Full HD LED vám poskytne více detailù ne standardní televizory HDTV. A více detailù obrazu pro vás znamená intenzivnìjší záitek ze sledování. 200 Hz PMR Spoleènost Philips vytvoøila technologii PMR pro zobrazení pohybu,které je pøesné,plynulé a pøirozené. PMR je standard pro mìøení ostrosti pohyblivého obrazu. Technologie Perfect Motion Rate je vısledkem spojení jedineèného zpracování obrazu,poètu snímkù za sekundu a obnovovací frekvence jednotlivıch snímkù,dokonalıch funkcí stmívání a technologie podsvícení. Vyšší èíslo PMR pøispívá k vìtšímu kontrastu a zøetelnìjšímu obrazu - co pro vás znamená obraz vynikající kvality.</p>  <h2>Pixel Plus HD</h2>  <p>Pokroèilá technologie pro zpracování digitálního obrazu zvyšuje poèet øádkù a pixelù. Vısledek znamená vdy obraz ostrı jako bøitva s neuvìøitelnımi detaily a hloubkou z jakéhokoli zdroje. Sluba Pause TV a nahrávání na zaøízení USB Potøebujete si udìlat pøestávku a pokraèovat ve sledování televize pozdìji? Funkce pozastavení znamená,e u nikdy nebudete muset èekat na reklamu - nebo ji sledovat! Chcete si nahrát ivé digitální televizní vysílání a sledovat je,a se vám to bude hodit? Najdìte své oblíbené programy pomocí Elektronického programového prùvodce (EPG) a mùete snadno naplánovat nahrávání. Jednoduchım pøipojením pevného disku USB k televizoru se vysílání pohodlnì uloí,abyste je mohli shlédnout pozdìji. Televize PHILIPS 32PFL4308 3D LED TV 4300 series, 32&quot;(81 cm), Full HD, 200PMR, DVB-T/C, HDMI,USB Full HD LED TV Na kvalitì obrazu záleí. Obyèejné televizory HDTV pøinášejí kvalitu,ale vy oèekáváte to nejlepší. Pøedstavte si úchvatnì ostré detaily ve spojení s vysokım jasem,neuvìøitelnım kontrastem,ostrım vykreslením pohybu,realistickımi barvami a vìrnım obrazem - a také se sníenou spotøebou energie. Tak u nemusíte dále hledat. Televizor Full HD LED vám poskytne více detailù ne standardní televizory HDTV. A více detailù obrazu pro vás znamená intenzivnìjší záitek ze sledování. 200 Hz PMR Spoleènost Philips vytvoøila technologii PMR pro zobrazení pohybu,které je pøesné,plynulé a pøirozené. PMR je standard pro mìøení ostrosti pohyblivého obrazu. Technologie Perfect Motion Rate je vısledkem spojení jedineèného zpracování obrazu,poètu snímkù za sekundu a obnovovací frekvence jednotlivıch snímkù,dokonalıch funkcí stmívání a technologie podsvícení. Vyšší èíslo PMR pøispívá k vìtšímu kontrastu a zøetelnìjšímu obrazu - co pro vás znamená obraz vynikající kvality. Pixel Plus HD Pokroèilá technologie pro zpracování digitálního obrazu zvyšuje poèet øádkù a pixelù. Vısledek znamená vdy obraz ostrı jako bøitva s neuvìøitelnımi detaily a hloubkou z jakéhokoli zdroje.</p>  <h2>Sluba Pause TV a nahrávání na zaøízení USB</h2>  <p>Potøebujete si udìlat pøestávku a pokraèovat ve sledování televize pozdìji? Funkce pozastavení znamená,e u nikdy nebudete muset èekat na reklamu - nebo ji sledovat! Chcete si nahrát ivé digitální televizní vysílání a sledovat je,a se vám to bude hodit? Najdìte své oblíbené programy pomocí Elektronického programového prùvodce (EPG) a mùete snadno naplánovat nahrávání. Jednoduchım pøipojením pevného disku USB k televizoru se vysílání pohodlnì uloí,abyste je mohli shlédnout pozdìji.</p> ";"<p>Meet the latest generation of LED TVs Philips, which include the thin<strong>Smart TV running Android.</strong> Gets you a fine painting, innovative technologies, including image processing Ambilight and honest materials used in production. It features cutting-edge design structures with an eye for detail that fits into modern interiors. Like basis was inclined central pedestal that represents the geometric pun. On TV it will always look nice even when switched off. </p><p> <strong>The main advantages:</strong> </p><ul><li> Ambilight backlighting - projecting a glow on the wall </li><li> Sharp and smooth image </li><li> Android operating system with applications </li><li> Internet connection </li><li> Remote control with keyboard </li></ul></div></div><div data-act=""block"" contenteditable=""false""><div data-act=""edit"" style=""position: relative;"" class=""cke_focus"" contenteditable=""false""><h3> Superior picture </h3><p> <strong>Ambilight backlighting will forever change your perception of television.</strong> This is a unique technology that expands the display area outside the boundaries of the panel itself. 2 Sided glow lit from two sides of the screen to the surrounding walls and creates a breathtaking effect. Natural Motion technology ensures smooth and crisp moving images without blur by increasing the number of frames per second to double. It's handy for example when movie action scenes or sports broadcasts. </p><p> <strong>Micro Dimming Pro conveys a realistic visual experience day and night.</strong> It uses a light sensor and a special software to optimize the contrast of the screen on the basis of light conditions in the environment. The image is analyzed 6400 in different zones, thereby providing authentic and undisturbed experience. Sharp moving images with breathtaking contrast, detail and depth ensure Pixel Precise HD. </p></div></div><div data-act=""block"" contenteditable=""false""><div data-act=""edit"" style=""position: relative;"" contenteditable=""false""><h3> Android - richer television viewing experience </h3><p> Built-in WiFi module, and an Ethernet port expands the possibilities of television. <strong>Are you tired of watching okoukanıch series?</strong> Then drop into online content. Waiting for you Archives TV stations, social networks, YouTube and other corners of the Internet via a web browser. Smart TV is based on Android OS 5.0 (Lollipop), has pre-installed applications and more can be found at Google Play. Use remote control with keyboard for easy typing text or even voice control. Advantage based on Android is also always up to date firmware. And all of you will be taken without waiting for a nimble run television is not only the old operating system, but also 2jádrovı processor. </p></div></div><div data-act=""block"" contenteditable=""false""><div data-act=""edit"" style=""position: relative;"" class=""cke_editable_inline cke_contents_ltr"" tabindex=""0"" spellcheck=""true"" role=""textbox"" aria-label=""Textovı editor, editor6"" title=""Text editor, editor6"" aria-describedby=""cke_230"" contenteditable=""false""><h3> Saving operation </h3><p> Manufacturer did not forget to decent connective equipment. It includes a quartet of HDMI connectors, one Scart and a trio of USB connectors for recording or playback of content by connecting USB disks. There is also support for HbbTV function or even suspend broadcasts EPG 8 days. Tuners are represented DVB-T / T2 / C and television unequivocal advantage of the economic operation. <strong>The TV comes to energy class A +,</strong> and for a very decent cuts only 45 kWh. </p><p><br> <strong>Additional information:</strong> </p><p> <strong>Picture Enhancement:</strong> <br> Natural Motion <br> 500Hz Perfect Motion Rate <br> Pixel Precise HD <br> Micro Dimming Pro </p><p> <strong>Smart TV:</strong> <br> User interaction - multiroom Client and Server, SimplyShare, certified Wi-Fi Certified Miracast <br> Interactive television - HbbTV <br> Program - Suspension of television broadcasting, USB recording <br> Applications SmartTV - Online video store, open an Internet browser, Social TV service, Spotify, TV on Demand, YouTube <br> Easy Installation - Automatic detection equipment Philips Connection Wizard equipment, Network Setup Wizard, the Setup Wizard <br> Easy to use - Universal Smart Menu button, on-screen User Guide <br> Firmware upgradeable - Guide cars. update, Firmware upgradeable via USB, Firmware Update online <br> Screen Format Adjustments - Basic - Fill Screen, Fit to Screen, Advanced - Pan, Zoom, Stretch <br> Philips TV Remote - Applications Channels, Control, NowOnTV, TV guide, Video on demand <br> Remote control - Keyboard </p><p> <strong>Ambilight:</strong> <br> Versions of Ambilight - 2 pages <br> Ambilight - The adaptation of the color of walls, Lounge Mode, Game Mode, Ambilight + hue </p><p> <strong>Multimedia applications:</strong> <br> Video playback formats - Containers: AVI, MKV, H264 / MPEG-4 AVC, MPEG-1, MPEG-2, MPEG-4, WMV9 / VC1, HEVC <br> Format Support subtitles - .SMI, .SRT, .ssa, .SUB, .TXT, .ass <br> Play music formats - AAC, MP3, WAV, WMA (v2 to v9.2), PRO-WMA (v9 and v10) <br> Picture Playback Formats - JPEG, BMP, GIF, JPS, PNG, PNS, BMS, MIT </p><p> <strong style=""font-family: Verdana, sans-serif, Arial; font-size: 13px;"">Connectivity:</strong> <br style=""font-family: Verdana, sans-serif, Arial; font-size: 13px;""> <span style=""font-family: Verdana, sans-serif, Arial; font-size: 13px;"">4 x HDMI</span> <br style=""font-family: Verdana, sans-serif, Arial; font-size: 13px;""> <span style=""font-family: Verdana, sans-serif, Arial; font-size: 13px;"">1 x Scart (RGB / CVBS)</span> <br style=""font-family: Verdana, sans-serif, Arial; font-size: 13px;""> <span style=""font-family: Verdana, sans-serif, Arial; font-size: 13px;"">3 x USB</span> <br style=""font-family: Verdana, sans-serif, Arial; font-size: 13px;""> <span style=""font-family: Verdana, sans-serif, Arial; font-size: 13px;"">Wireless Dual Band Wi-Fi Direct, Integrated Wi-Fi 11n 2 × 2</span> <br style=""font-family: Verdana, sans-serif, Arial; font-size: 13px;""> <span style=""font-family: Verdana, sans-serif, Arial; font-size: 13px;"">Other connections: Antenna IEC75, Common Interface Plus (CI +), Ethernet-LAN ??RJ-45, Digital audio output (optical), Audio L / R, Audio Input (DVI), Headphone out, Service connector, the connector Satellite</span> <br style=""font-family: Verdana, sans-serif, Arial; font-size: 13px;""> <span style=""font-family: Verdana, sans-serif, Arial; font-size: 13px;"">HDMI features - Audio Return Channel</span> <br style=""font-family: Verdana, sans-serif, Arial; font-size: 13px;""> <span style=""font-family: Verdana, sans-serif, Arial; font-size: 13px;"">EasyLink (HDMI-CEC) - Pass the remote control signal, System audio control, System standby, One touch play</span> </p><p> <strong>Supplied</strong> <br> Remote control <br> 2 x AAA Batteries <br> Table top stand <br> Power cable <br> Quick start guide use <br> Brochure Legal and safety information </p>";8173.5;high;15.1.2000;;200;pcs;in-stock;"[cs:Úhlopøíèka,en:Screen size]=[cs:30"",en:30""];[cs:Technologie]=[cs:LED];[cs:Rozlišení,en:Resolution]=[cs:1920×1080 (Full HD),en:1920×1080 (Full HD)];[cs:USB]=[cs:Ano];[cs:HDMI]=[cs:Ne]";tv;tv;top;false;philips;
"47"" LG 47LA790V (FHD)";"47"" LG 47LA790V (FHD)";5965879P;47LA790V;8845781245928;"<p>Cinema 3D Smart TV LG 47LA790V se Cinema 3D Screen Designem je 3D televizor s technologií LG Cinema 3D a úhlopøíèkou 47&quot;, kterı urèitì splní vaše oèekávání. Oplıvá veškerou moderní obrazovou technologií LG, která je zárukou vıjimeèné kvality obrazu s vysokou vìrností barev a hlubším kontrastem vèetnì <span style=""color:#FF0000""><strong>konverze z 2D na 3D</strong></span>, která vám umoní sledovat bìné televizní vysílání ve 3D prostorovém obrazu.</p>  <p><img alt="""" src=""http://en.icône.com/images/icones/1/4/video-television-2.png"" style=""height:256px; width:256px"" /></p>  <p>Pøíjemnım pøekvapením pro vaše dìti bude také funkce Dual Play umoòující <strong><span style=""color:#FF0000"">hraní her ve dvou lidech bez rozdìlení obrazovky televize</span></strong>. Tento model Cinema 3D LED TV poskytuje kromì sníení spotøeby energie také rùzné moností konektivity, disponuje integrovanımi DVB-T/C/S2 tunery a technologií Smart Energy Saving. Oproti niším øadám je vybaven lepším dvoujádrovım procesorem a Magickım stojanem a lze k nìmu dokoupit TV kameru AN-VC500. Poznejte bohatı a stále se rozšiøující svìt 3D zábavy, kterı máte na dosah ruky - staèí jen pouít Magickı dálkovı ovladaè Karta Svìt 3D v menu LG TV nabízí nekoneèné mnoství 3D obsahu, kterı zahrnuje filmy, sport, hudbu, videa, vzdìlávací poøady a mnoho dalšího!</p>  <h2>FLICKER FREE - 3D OBRAZ BEZ BLIKÁNÍ</h2>  <p>Uívejte si 3D TV, její sledování je mnohem pøíjemnìjší pro Vaše oèi, protoe obraz vùbec nebliká. Na rozdíl od bìnıch 3D TV, LG CINEMA 3D Smart TV vùbec nebliká a 3D obraz je mnohem jasnìjší. To je mnohem pøíjemnìjší pro Vaše oèi a obraz je èistší a ostøejší, take Vám pøijde, jako by vystupoval úplnì z obrazovky. Cinema 3D Smart TV LG 47LA790V se Cinema 3D Screen Designem je 3D televizor s technologií LG Cinema 3D a úhlopøíèkou 47&quot;, kterı urèitì splní vaše oèekávání. Oplıvá veškerou moderní obrazovou technologií LG, která je zárukou vıjimeèné kvality obrazu s vysokou vìrností barev a hlubším kontrastem vèetnì konverze z 2D na 3D, která vám umoní sledovat bìné televizní vysílání ve 3D prostorovém obrazu. Pøíjemnım pøekvapením pro vaše dìti bude také funkce Dual Play umoòující hraní her ve dvou lidech bez rozdìlení obrazovky televize. Tento model Cinema 3D LED TV poskytuje kromì sníení spotøeby energie také rùzné moností konektivity, disponuje integrovanımi DVB-T/C/S2 tunery a technologií Smart Energy Saving. Oproti niším øadám je vybaven lepším dvoujádrovım procesorem a Magickım stojanem a lze k nìmu dokoupit TV kameru AN-VC500. Poznejte bohatı a stále se rozšiøující svìt 3D zábavy, kterı máte na dosah ruky - staèí jen pouít Magickı dálkovı ovladaè Karta Svìt 3D v menu LG TV nabízí nekoneèné mnoství 3D obsahu, kterı zahrnuje filmy, sport, hudbu, videa, vzdìlávací poøady a mnoho dalšího!&nbsp;</p>  <p><iframe align=""middle"" frameborder=""1"" height=""400"" longdesc=""adresa sídla fírmy netdevelo"" name=""netdevelo"" scrolling=""yes"" src=""http://www.mapy.cz/s/cQc0"" title=""Kde nás najdete"" width=""600""></iframe></p> ";"<h2>47 ""LG 47LA790V</h2><div id=""flix"" class=""clearRight""></div><div id=""cpcm_cpc_mediaDescription""><div id=""desc""><div style=""min-height: 0px;"" class=""lazyDescription"" id=""descAnnotation"" data-code=""WK306k""><div style=""width: 100%; display: inline;""><div class=""grayGradient"" style=""border: none;""> Luxury TV from the South Korean company LG bears <strong> 47LA790S </strong> . At first glance its <strong> beautiful design </strong> That pleases the eye of every lover of pure and precise shapes. Inside the TV is hidden except <strong> M13 dual-core processor </strong> number of extra features. I so belong to the energy class <strong> A + </strong> . Micro Pixel Control function is performed local dimming backlight and thus significantly <strong> reduces </strong> up to 64 W. This is so gigantic screen with really great. <br> <br> This TV is considerate to your eyes because of the image <strong> eliminates the annoying flicker </strong> caused by conventional 3D glasses, and you so you can enjoy long evenings of film <strong> without fatigue and eye pain </strong> . User-friendly environment allows <strong> adjust the 3D depth effect </strong> and yourself, you can choose whether you prefer comfort or deeper experience when watching 3D content. You could very well happen that while watching a football match <strong> flips the ball right into your living room </strong> Because special functions for image conversion<strong> improve any broadcasting the third dimension </strong> . <br> <br> Avid gamers will appreciate the <strong> Dual Play </strong> When television broadcasts two separate 2D images and each player using glasses to see their part to the full screen area. No more worry when a split screen. <strong> Intel WiDi </strong> (Wireless Display), respectively. wireless transmission of video and audio, allows quick and easy connection of TVs and laptops without cables or an Internet connection. It is very convenient and fast you'll love this feature. </div>";17843;high;14.1.2000;;800;pcs;in-stock;"[cs:Úhlopøíèka,en:Screen size]=[cs:47"",en:47""];[cs:Technologie]=[cs:LED];[cs:Rozlišení,en:Resolution]=[cs:1920×1080 (Full HD),en:1920×1080 (Full HD)];[cs:USB]=[cs:Ano];[cs:HDMI]=[cs:Ne]";tv;tv;;false;lg;
A4tech myš X-710BK, OSCAR Game, 2000DPI, èerná;A4tech mouse X-710BK, OSCAR Game, 2000DPI, black,;5960453;X-710BK;8845781245923;"<h2>Herní poèítaèová myš A4Tech X-710BK s pìti tlaèítky a scrolovacím koleèkem pro snadnìjší ovládání dokumentù, èi prohlíení internetovıch stránek.</h2>  <p>Novinkou u této série je 3XFire tlaèítko, které pøi jednom zmáèknutí reaguje jako troj-klik. Další inovací je 5 DPI zmìna citlivosti snímáèe a to v krocích 400/600/1200/1600/2000 DPI. Myš je pohodlnì tvarovaná a pøipojuje se pomocí USB rozhraní. Novinkou je 16KB interní pamì do které je moné pomocí programu Oskar Mouse Editor nahrávat scripty na Vaše oblíbené hry. A4tech X710BK Herní poèítaèová myš vybavená pìti tlaèítky a scrolovacím tlaèítkem pro snadnìjší ovládání dokumentù nebo prohlíení internetovıch stránek. Novinkou je pak tlaèítko 3XFire, které pøi jednom zmáèknutí reguje jako trojité kliknutí. Myš disponuje moností nastavit a pìt citlivostí snímaèe a to v krocích 400, 600, 1200, 1600 a 2000 DPI. Myš má ergonomickı design, pøipojuje se pøes vysokorychlostní USB rozhraní a je vybavena 16 Kb interní pamìti, do které je moné pomocí programu Oscar Mouse Editor nahrávat scripty pro ovládání vašich oblíbenıch her.</p>  <p><strong>Je plnì kompatibilní se všemi moderními operaèními systémy vèetnì Windows Vista. </strong></p>  <h3>Parametry a specifikace:</h3>  <ol>  <li>Rozhraní: USB 2.0</li>  <li>Redukce do PS/2</li>  <li>Kompatibilita OS: Microsoft Windows 2000/XP/2003/Vista.</li> </ol>  <p><img alt="""" src=""http://img3.wikia.nocookie.net/__cb20120522000532/animalcrossing/images/b/b7/Mouse.jpg"" style=""height:380px; width:380px"" /></p>  <p>&nbsp;</p> ";"<h2>A4tech X710BK</h2><div id=""flix"" class=""clearRight""></div><div id=""cpcm_cpc_mediaDescription""><div id=""desc""><div style=""min-height: 0px;"" class=""lazyDescription"" id=""descAnnotation"" data-code=""ME422f2""><div style=""width: 100%; display: inline;""> Playing computer mouse has five buttons and scrolovacím button for easier browsing documents or Internet pages. News is a key 3XFire that in one pressing regulating a triple clicks. The mouse has five options to set up the sensor sensitivity and in steps 400, 600, 1200, 1600 and 2000 DPI. The mouse has an ergonomic design, it connects via high-speed USB interface and is equipped with 16 Kb internal memory that is possible with the Oscar Mouse Editor to record scripts to control your favorite games. It is fully compatible with all modern operating systems including Windows Vista. <br><br><strong> Specifications: </strong><br><br><strong> Interface: </strong><br> USB 2.0 <br> Reduction in PS/2 <br><br><strong> OS Compatibility: </strong><br> Microsoft Windows 2000/XP/2003/Vista </div>";263.6;high;9.1.2000;;;pcs;in-stock;"[cs:Herní myš]=[cs:Ano];[cs:Ergonomie]=[cs:Pravoruká];[cs:Podporovanı OS]=[cs:Windows 2000/XP/Vista/7];[cs:Poèet tlaèítek]=[cs:5]";pc;pc;;false;a4tech;
