name_cs;name_en;catnum;partno;ean;description_cs;description_en;price;vat;sellingFrom;sellingTo;stockQuantity;unit;availability;parameters;categories1;categories2;flags;sellingDenied;brand;mainVariantCatnum
RO-3107 radiátor olejovı;RO-3107 oil radiator;ro3107;8594049734528;8845781245988;<p>Proijte chladné dny pìknì v teple. Olejovı radiátor Vás zahøeje v chladnıch mìsících roku. Vyniká 3 vıkonovımi stupni, je vybaven ochranou proti pøehøátí. Koleèka a madlo radiátoru Vám usnadní manipulaci s ním.</p><br /><br /><h2>Dùvody, proè se rozhodnout právì pro olejovı radiátor RO-3107:</h2><br /><br /><ol><li>Olejovı radiátor RO-3107 zaruèuje <strong>stálé teplo</strong> díky svému vıkonu a velikosti.</li><br /><li>Olejovı radiátor je vybaven <strong>termostatem</strong>. Ovladaèem termostatu mùete nastavit poadovanou teplotu vmístnosti.</li><br /><li>U olejového radiátoru RO-3107 si mùete libovolnì nastavit <strong>3 vıkonové stupnì</strong>: 600 / 900 / 1500 W.</li><br /><li>Radiátor má také <strong>dvojitou tepelnou pojistkou</strong> proti pøehøátí, která radiátor vypne, jakmile dojde k nìjaké technické disfunkci nebo pokud je špatnì pouíván.</li><br /><li>Pro snadné pøemístìní olejového radiátoru jsou zde <strong>praktická kola</strong> a <strong>madlo</strong>, a také <strong>drák na kabel</strong>.</li></ol><br /><br /><h2>Technické parametry:</h2><br /><br /><ul><li>7 èlánkù</li><br /><li>3 vıkonové stupnì</li><br /><li>Vypínaè se svìtelnou kontrolkou</li><br /><li>Dvojitá ochrana proti pøehøátí</li><br /><li>Koleèka pro snadné pøemístìní</li><br /><li>Úchyt pro kabel</li><br /><li>Rozmìry: 360 x 600 x 140 mm (š x v x h)</li><br /><li>Délka pøívodního kabelu: 170 cm</li><br /><li>Hmotnost: 8,3 kg</li><br /><li>Barva: svìtle šedá</li><br /><li>Pøíkon: 600 / 900 / 1500 W</li><br /><li>Napìtí: 230 V</li></ul>;<p> Enjoy cold days pretty warm. Oil radiator you warm in the cold months of the year. 3 excels output stages, is equipped with protection against overheating. Wheels and handles radiator will facilitate handling. </ P> <br /> <br /> <h2> Reasons to opt just for the oil radiator RO-3107: </ h2> <br /> <br /> <ol> <li> Oil radiator RO-3107 provides <strong> constant heat </ strong> thanks to its performance and size. </ li> <br /> <li> Oil radiator is fitted <strong> thermostat </ strong> . Turn the thermostat, you can set the desired temperature vmístnosti. </ Li> <br /> <li> In the oil radiator RO-3107 you can customize <strong> 3 power levels </ strong>: 600/900 / 1500W. </ Li > <br /> <li> The radiator also has a <strong> double thermal fuse </ strong> against overheating, which turns off the heater as soon as some technical dysfunctions or if it is incorrectly used. </ li> <br /> <li > For easy removal of the oil radiator are <strong> practical wheel </ strong> and <strong> handle </ strong> and <strong> mount cable </ strong>. </ li> </ ol> <br /> <br /> <h2> Specifications: </ h2> <br /> <br /> <ul> <li> 7 articles </ li> <br /> <li> 3 power levels </ li> <br /> <li> The switch indicator light </ li> <br /> <li> Double protection against overheating </ li> <br /> <li> wheels for easy relocation </ li> <br /> < li> Clip for cable </ li> <br /> <li> Dimensions: 360 x 600 x 140 mm (WxHxD) </ li> <br /> <li> Cord Length: 170 cm </ li> < br /> <li> Weight: 8.3 kg </ li> <br /> <li> Color: light gray </ li> <br /> <li> Power: 600/900/1500 W </ li> <br /> <li> Voltage: 230 V </ li> </ ul>;1499;high;9.1.2000;;94;pcs;in-stock;;garden_tools;garden_tools;;false;;
HEPA filtr  VP-9231;HEPA filter VP-9231;44291426;8594049734696;8845781245989;;;249;high;11.2.2014;;7;pcs;in-stock;;garden_tools;garden_tools;;false;;
Trubky teleskopické kovové VP-9222;Telescopic metal pipes VP-9222;44291409;;8845781245990;;;299;high;25.1.2014;;84;pcs;in-stock;;garden_tools;garden_tools;;false;;
NS-9235 ANTI ODOUR náhradní sáèky pro VP-9231;NS-9235 ANTI ODOUR spare bags for the VP-9231;ns9235;8594049734689;8845781245991;Náhradní sáèky pro vysavaèe CONCEPT Hamilton VP 9231. 5 kus v balení.;Replacement bags for vacuum cleaners CONCEPT Hamilton VP 9,231th 5 piece in the package.;319;high;3.8.1999;;5;pcs;in-stock;;garden_tools;garden_tools;;false;;
Hubice na èalounìní + kartáèek VP-9231;Upholstery brush + VP-9231;44291462;;8845781245992;;;79;high;3.2.2013;;944;pcs;in-stock;;garden_tools;garden_tools;;false;;
Hubice štìrbinová VP923x VP813x VP914x VP8230;Crevice nozzle VP923x VP813x VP914x VP8230;44291461;;8845781245993;;;79;high;24.1.2014;;87;pcs;in-stock;;garden_tools;garden_tools;;false;;
PC-5040 Pekárna chleba s bezlepkovım programem;PC-5040 bakery bread with gluten-free program;pc5040;8594049734771;8845781245994;<h2>Chcete mít dennì èerstvou snídani? Nechte si chléb upéct pøes noc pomocí funkce  odloeného startu této domácí pekárny. Pekárna vyniká i speciálním funkcí na pøípravu bezlepkového chleba, marmelád a tìsta na nudle a tìstoviny.</h2><br /><br /><h3>Dùvody, proè se rozhodnout právì pro domácí pekárnu PC-5040 VITA STYLE:</h3><br /><br /><p>Domácí pekárna chleba Concept VITA STYLE má celou øadu vıhod, díky kterım umí usnadnit ivot v kadé domácnosti. Celı proces peèení chleba je plnì automatickı, staèí vloit ingredience a zvolit pøíslušnı program.</p><br /><p>Pekárna je pøizpùsobená pro 750 g – 1250 g tìsta, je jen na Vás, pro kolik strávníkù si budete pøát chléb upéct.</p><br /><p>Pekárna Vás okouzlí rozmanitım mnostvím programù, díky kterım má pekárna opravdu široké vyuití v našich domácnostech. Kromì peèení rùznıch druhù chleba (pšeniènı, itnı, celozrnnı, francouzskı, sladkı, bezlepkovı) lze pekárnu Concept vyuít také pro pøípravu tìst k dalšímu pouití (kynuté koláèe, rohlíky, mouèníky, tìstoviny, nudle) a také k vırobì demù, zavaøenin a kompotù.</p><br /><p>Peèící nádoba je opatøena dvìma hnìtacími háky pro kvalitní hnìtení tìsta, nepøilnavou povrchovou úpravou a také moností mıt nádobu v myèce.</p><br /><p>Nastavitelnı 12ti hodinovı èasovaè pohodlnì zajistí, e peèení chleba zaène zcela automaticky a díky tichému provozu pekárny je moné nechat chleba péct i pøes noc.</p><br /><p>Pro inspiraci je v návodu pekárny uvedeno nìkolik zajímavıch receptù.</p><br /><br /><h2>Technické parametry:</h2><br /><ul><br /><li>Speciální funkce: peèení bezlepkového chleba + vıroba marmelád, zavaøenin a kompotù + pøíprava tìsta na nudle a  tìstoviny</li><br /><li>Dva hnìtací háky</li><br /><li>Pro 750 g – 1250 g tìsta</li><br /><li>1 nepøilnavá vyjímatelná forma: hranatá</li><br /><li>12 pøedvolenıch programù</li><br /><li>Velkı LCD displej s popisem programù</li><br /><li>Monost zvolit stupeò propeèení kùrky: svìtlá, støední, tmavá</li><br /><li>Odloenı start a 12 hodin</li><br /><li>Funkce udrení teploty po dobu 60ti minut (KEEP WARM)</li><br /><li>Velké okénko</li><br /><li>Protiskluzové noièky</li><br /><li>Nádobka s odmìrkou</li><br /><li>Rozmìry: 430 x 280 x 280 mm (š x v x h)</li><br /><li>Délka pøívodního kabelu: 80 cm</li><br /><li>Hmotnost: 5,9 kg</li><br /><li>Barva: bílá</li><br /><li>Pøíkon: 850 W</li><br /><li>Napìtí: 220-240 V</li></ul>;<h2> Want to have daily fresh breakfast? Let the bread bake overnight using the delayed start of homemade bread. Bakery stands and special functions to prepare gluten-free bread, jam and dough for noodles and pasta. </ H2> <br /> <br /> <h3> Reasons to opt just for home bakery PC-5040 VITA STYLE: </ h3> <br /> <br /> <p> Home bakery bread Concept VITA STYLE has a number of advantages that make can make life easier in every household. The entire process of baking bread is fully automatic, just put the ingredients and choose the appropriate program. </ P> <br /> <p> The bakery is adapted to 750 g - 1250 g dough is up to you, how many diners you want bread bake. </ p> <br /> <p> The bakery will enchant you with a diverse number of programs that make bakery has really wide use in our homes. In addition to baking different kinds of bread (wheat, rye, whole wheat, French, sweet, gluten-free) can Bakery Concept also be used to prepare the dough for another use (yeast cakes, croissants, pastries, pasta, noodles) and also for the production of jams, preserves and compotes . </ p> <br /> <p> The baking pan is equipped with two kneading hooks for kneading dough quality, non-stick coating, as well as the possibility to wash the dishes in the dishwasher. </ p> <br /> <p> Adjustable 12-hour timer comfortably ensure that baking bread starts automatically and quiet operation thanks to the bakery can bake bread and leave overnight. </ p> <br /> <p> For inspiration is in the operating bakeries are some interesting recipes. </ p> < br /> <br /> <h2> Specifications: </ h2> <br /> <ul> <br /> <li> Special features: gluten-free bread baking + production of marmalades, jams and compotes + preparing dough into noodles Pasta </ ??li> <br /> <li> The two dough hooks </ li> <br /> <li> 750 g - 1250 g dough </ li> <br /> <li> 1 non-stick removable form: square </ li> <br /> <li> 12 preset programs </ li> <br /> <li> Large LCD display with a description of the program </ li> <br /> <li> Ability to choose the degree of browning the crust: light, medium, dark </ li> <br /> <li> Delayed start up to 12 hours </ li> <br /> <li> The temperature maintenance for a period of 60 minutes (KEEP WARM) </ li> <br /> < li> Large window </ li> <br /> <li> Anti-slip feet </ li> <br /> <li> container with scoop </ li> <br /> <li> Dimensions: 430 x 280 x 280 mm (WxHxD) </ li> <br /> <li> Cord Length: 80 cm </ li> <br /> <li> Weight: 5.9 kg </ li> <br /> <li> Color : White </ li> <br /> <li> Power: 850 W </ li> <br /> <li> Voltage: 220-240 V </ li> </ ul>;2499;high;22.1.2014;;7;pcs;in-stock;;garden_tools;garden_tools;;false;;
Plech peèicí hlubokı ETV-2460;Deep baking sheet ETV-2460;62790018;;8845781245995;;;299;high;6.1.2000;;5474;pcs;in-stock;;garden_tools;garden_tools;;false;;
Plech peèicí mìlkı ETV-2460;Shallow baking sheet ETV-2460;62790019;;8845781245996;<p>Rozmìry plechu: 34,5 x 1,5 x 44 cm (šxvxh)</p>;<p> Sheet Size: 34.5 x 1.5 x 44 cm (WxHxD) </ p>;249;high;4.1.2000;;454;pcs;in-stock;;garden_tools;garden_tools;;false;;
Talíø sklenìnı MTV-3017 pr. 245 mm;Plate glass MTV-3017 pr. 245 mm;62390018;;8845781245997;;;299;high;31.1.2014;;4;pcs;in-stock;;garden_tools;garden_tools;;false;;
NS-9090 náhradní sáèky papírové pro VP-9090;NS-9090 replacement bags of paper for the VP-9090;ns9090;8594049734863;8845781245998;Náhradní papírové sáèky pro vysavaèe CONCEPT 1500 VP 9090. Balení: 5 ks sáèkù +filtry.;Spare paper bags for vacuum cleaners CONCEPT 1500 VP 9090th Package: 5 pieces + bag filters.;119;high;20.1.2014;;4849;pcs;in-stock;;garden_tools;garden_tools;;false;;
Rotaèní sítko LO-7030;Rotary sieve LO-7030;42390382;;8845781245999;;;259;high;13.2.2014;;89;pcs;in-stock;;garden_tools;garden_tools;;false;;
Nádoba na šávu LO-7030;Juice container LO-7030;42390396;;8845781246000;;;199;high;10.1.2000;;456;pcs;in-stock;;garden_tools;garden_tools;;false;;
Hadice VP-5060;Hose VP-5060;44291466;;8845781246001;;;499;high;1.2.2014;;94;pcs;in-stock;;garden_tools;garden_tools;;false;;
HEPA filtr VP-5060;HEPA filter VP-5060;44291489;8594049737413;8845781246002;;;199;high;11.1.2000;;4848;pcs;in-stock;;garden_tools;garden_tools;;false;;
Plech peèicí mìlkı ETV-5260;Shallow baking sheet ETV-5260;62790043;;8845781246003;;;549;high;2.2.2014;;49;pcs;in-stock;;garden_tools;garden_tools;;false;;
Plech peèicí ETV-6260/6860/7x60/8x60;Baking sheet ETV-6260/6860 / 7x60 / 8x60;62790104;;8845781246004;;;499;high;12.1.2000;;84;pcs;in-stock;;garden_tools;garden_tools;;false;;
Redukce prùmìru z 35 mm na 32 mm;Reducing the diameter of 35 mm to 32 mm;44291501;;8845781246005;;;85;high;23.1.2014;;48;pcs;in-stock;;garden_tools;garden_tools;;false;;
OPV-3260 Vestavnı odsavaè vısuvnı 60cm;OPV-3260 Built-in retractable hood is 60 cm;opv3260;8594049735587;8845781246006;<p>Vısuvnı odsavaè par je velice elegantní a praktickou variantou klasického odsavaèe s minimální prostorovou nároèností, proto je vhodnı i pro malé kuchynì. Nerezová pøední lišta s kolébkovım pøepínaèem umoòuje snadné ovládání.</p><br /><br /><h2>Dùvody, proè se rozhodnout právì pro vısuvnı odsavaè par Concept OPV-3260:</h2><br /><br /><ol><li>Vıkon je nejdùleitìjším parametrem odsavaèù  a mìl by odpovídat minimálnì desetinásobku objemu místnosti. Vısuvnı odsavaè par znaèky Concept  OPV-3260 Vás pøekvapí <strong>vıkonem 198 m3 za hodinu</strong>.</li><br /><li>Model OPV-3260 je vybaven <strong>dvìma</strong> praktickımi <strong>kovovımi filtry proti mastnotám</strong>, jejich údrba je velice snadná a ivotnost neomezená. Pokud nemáte monost odvést páry ven, mùete zvolit namísto klasického odtahu <strong>systém recirkulace</strong> s uitím 2 uhlíkovıch filtrù, které lze dokoupit (kat.èíslo: 61990005).</li><br /></ol><br /><br /><h2>Technické parametry:</h2><br /><br /><ul><li>Vıška: 175 mm</li><br /><li>Šíøka: 600 mm</li><br /><li>Hloubka: 310-470 mm</li><br /><li>Pøíslušenství: zpìtná klapka</li><br /><li>Nerezová pøední lišta</li><br /><li>Monost horního odtahu nebo recirkulace</li><br /><li>Kolébkovı pøepínaè</li><br /><li>2 stupnì vıkonu</li><br /><li>Max. vıkon: 198 m3/hod.</li><br /><li>Max.hluènost na nejvyšším stupni 66dB (A)</li><br /><li>árovka 40 W</li><br /><li>2x kovovı filtr proti mastnotám</li><br /><li>Prùmìr odtahu: 120 mm</li><br /></ul><br /><br /><h2>Detailní popis:</h2><br /><br /><ul><li>Volitelné pøíslušenství: 2x uhlíkovı filtr 61990005</li><br /><li>1 motor/ventilátor</li><br /><li>Minimální vzdálenost od elektrické varné desky: 650 mm</li><br /><li>Minimální vzdálenost od plynové varné desky: 750 mm</li><br /><li>Rozmìry pro zabudování (vxšxh): 133 x 560 x 272 mm</li><br /><li>Netto hmotnost: 5,9 kg</li><br /><li>Napìtí: 230 V ~ 50 Hz</li><br /><li>Pøíkon: 150 W</li><br /><li>Délka pøívodního kabelu: 2,2 m</li></ul>;<p> The telescopic hood is very elegant and practical variant of the classical extractor with minimum space requirements, making it suitable for small kitchens. Stainless steel front bar with rocker switch for easy operation. </ P> <br /> <br /> <h2> Reasons to opt just for telescopic cooker hood Concept OPV-3260: </ h2> <br /> <br /> <ol> <li> Performance is the most important parameter hoods and should be at least equal to ten times the volume of the room. Telescopic cooker hood Brand Concept OPV-3260 will surprise you <strong> output of 198 m3 per hour </ strong>. </ Li> <br /> <li> Model AL-3260 is equipped with <strong> two mA </ strong> practical < strong> metal grease filters </ strong>, whose maintenance is very easy and unlimited lifespan. If you can not pay out of steam, you can choose instead of exhaust classic <strong> recirculation system </ strong> using two carbon filters, which can be bought (kat.èíslo: 61990005). </ Li> <br /> </ ol> <br /> <br /> <h2> Specifications: </ h2> <br /> <br /> <ul> <li> Height: 175 mm </ li> <br /> <li> Width: 600 mm </ li> <br /> <li> Depth: 310-470 mm </ li> <br /> <li> Accessories: backflow preventer </ li> <br /> <li> Stainless steel front bar </ li > <br /> <li> Ability to upper exhaust or recirculation </ li> <br /> <li> Rocker Switch </ li> <br /> <li> 2 power levels </ li> <br /> <li > Max. Performance 198 m3 / h. </ li> <br /> <li> Max.hluènost the highest level of 66 db (A) </ li> <br /> <li> The bulb 40 W </ li> <br /> <li> 2x the grease filter </ li> <br /> <li> diameter: 120 mm </ li> <br /> </ ul> <br /> <br /> <h2> Detailed description: </ h2> <br /> <br /> <ul> <li> Optional Accessories: 2x carbon filter 61990005 </ li> <br /> <li> 1 motor / fan </ li> <br /> <li > Minimum distance from electric hob 650 mm </ li> <br /> <li> Minimum distance from gas hob: 750 mm </ li> <br /> <li> Dimensions for installation (HxWxD): 133 x 560 x 272 mm </ li> <br /> <li> Net weight: 5.9 kg </ li> <br /> <li> Voltage: 230 V ~ 50Hz </ li> <br /> <li > Power: 150 W </ li> <br /> <li> Cord Length: 2.2 m </ li> </ ul>;3290;high;10.2.2014;;48;pcs;in-stock;;garden_tools;garden_tools;;false;;
OPP-2060  Odsavaè par podstavnı 60 cm;OPP-2060 Hood sub-mounting 60 cm;opp2060;8594049735594;8845781246007;<p>Minimální prostorovou nároèností vyniká podstavnı odsavaè par OPP-2060. Vhodnı  i pro velmi malé kuchynì. Kovová tlaèítka zajišují jednoduchost ovládání a pøesné nastavení odpovídajícího stupnì vıkonu.</p><br /><br /><h2>Dùvody, proè se rozhodnout právì pro podstavnı odsavaè par Concept OPP-2060:</h2><br /><br /><ol><li>Vıkon je nejdùleitìjším parametrem odsavaèù  a mìl by odpovídat minimálnì desetinásobku objemu místnosti. Podstavnı odsavaè par znaèky Concept  OPP-2060 Vás pøekvapí vıkonem <strong>186 m3 za hodinu</strong>.</li><br /><li>Velice praktická je monost navolit <strong>4 zpùsoby odtahu</strong>.</li><br /><li>Model OPP-2060 je vybaven praktickım <strong>kovovım filtrem proti mastnotám</strong>, jeho údrba je velice snadná a ivotnost neomezená. Pokud nemáte monost odvést páry ven, mùete zvolit namísto klasického odtahu <strong>systém recirkulace</strong>s uitím  uhlíkového filtru, kterı lze dokoupit. Jakmile bude filtr zneèištìnı, odsavaè Vás sám upozorní.</li><br /></ol><br /><br /><h2>Technické parametry:</h2><br /><br /><ul><li>Vıška: 150 mm</li><br /><li>Šíøka: 600 mm</li><br /><li>Hloubka: 490 mm</li><br /><li>Pøíslušenství: zpìtná klapka</li><br /><li>Nerezové provedení</li><br /><li>Monost horního, zadního, boèního levého a pravého odtahu nebo recirkulace</li><br /><li>Kovová tlaèítka</li><br /><li>3 stupnì vıkonu</li><br /><li>Max. vıkon: 186 m3/hod.</li><br /><li>Max.hluènost na nejvyšším stupni 66 dB (A)</li><br /><li>árovka 40 W</li><br /><li>1x kovovı filtr proti mastnotám</li><br /><li>Prùmìr odtahu: 100 mm</li><br /></ul><br /><br /><h2>Detailní popis:</h2><br /><br /><ul><li>Volitelné pøíslušenství: 1x uhlíkovı filtr 61990022</li><br /><li>1 motor/ventilátor</li><br /><li>Minimální vzdálenost od elektrické varné desky: 650 mm</li><br /><li>Minimální vzdálenost od plynové varné desky: 750 mm</li><br /><li>Netto hmotnost: 4,8 kg</li><br /><li>Napìtí: 230 V ~ 50Hz</li><br /><li>Pøíkon: 150 W</li><br /><li>Délka pøívodního kabelu: 1,2 m</li></ul>;<p> The minimum space requirements excels sub-mounting range hood OPP-2060th Suitable for very small kitchens. Metal buttons provide ease of use and precise adjustment of the corresponding stage performance. </ P> <br /> <br /> <h2> Reasons to choose just the sub-mounting range hood Concept OPP-2060: </ h2> <br /> <br /> <ol> <li> Performance is the most important parameter hoods and should be at least equal to ten times the volume of the room. The sub-mounting range hood brand Concept OPP-2060 will surprise performance <strong> 186 m3 per hour </ strong>. </ Li> <br /> <li> Very practical is the ability to select <strong> 4 Ways exhaust </ strong>. </ li> <br /> <li> Model OPP-2060 is equipped with a practical <strong> metal grease filter </ strong>, its maintenance is very easy and unlimited lifespan. If you can not pay out of steam, you can choose instead of exhaust classic <strong> recirculation system </ strong> using a carbon filter, which can be bought.;2990;high;19.1.2014;;48;pcs;in-stock;;garden_tools;garden_tools;;false;;
Filtr uhlíkovı OPK44xx / OPK-5690 / OPK5790 / OPO55xx;OPK44xx carbon filter / OPK-5690 / OPK5790 / OPO55xx;61990002;8594049737383;8845781246008;295 x 240 x 15 mm<br />kazeta s aktivnim uhlikem;295 x 240 x 15 mm <br /> cartridge with active carbon;499;high;5.1.2000;;489;pcs;in-stock;;garden_tools;garden_tools;;false;;
POS kuchaøka_parní trouba CZ;POS kuchaøka_parní oven GB;POScook_book_CZ;POScook_book_CZ;8845781246009;<h2>Kuchaøka<h2><br /><br /><p>Co vše lze vaøit v parní troubì?<br />Pouití parní trouby Concept  je pøekvapivì všestranné. Lze v ní pøipravit pøedkrmy, polévky, maso, ryby, zeleninu, vegetariánská jídla, knedlíky, rıi, ovoce i dezerty.<br />75 stran kuchaøky Concept – Vaøíme zdravì, vaøíme v páøe - obsahuje recepty s praktickımi postupy. Kadı recept obsahuje:</p><br /><br /><p>Seznam ingrediencí</p><br /><p> Postup</p><br /><p>Pro kolik osob</p><br /><p>Doba pøípravy</p><br /><p>Stupeò obtínosti</p><br /><p> Funkce + doba + teplota</p><br /><br /><ul><li>Z pod poklièky prozradíme pár tipù – Chøest s tuòákovou omáèkou, Losos ve vermutové omáèce, Polévka minestrone, Kuøecí mátové pøekvapení, Zelné listy plnìné mletım masem, Grilovaná kotleta se zeleninou, Brambory zapékané s nivou, Hruška s èokoládovou omáèkou, praenımi mandelimi a zmrzlinou atd.</li></ul><br /><br />;<h2> Cookbook <h2> <br /> <br /> <p> What can be cooked in a steam oven? <br /> Using a steamer Concept is surprisingly versatile. It can be used to prepare appetizers, soups, meat, fish, vegetables, vegetarian dishes, dumplings, rice, fruit and desserts. <br /> 75 pages of cookbooks Concept - cook healthy steamed - contains recipes with practical procedures. Each recipe includes: </ p> <br /> <br /> <p> The list of ingredients </ p> <br /> <p> Method </ p> <br /> <p> How many people </ p > <br /> <p> Preparation time </ p> <br /> <p> The degree of difficulty </ p> <br /> <p> + time + temperature </ p> <br /> <br / > <ul> <li> From under the lids give you some tips - Asparagus with tuna sauce, salmon in vermouth sauce, soup minestrone, chicken mint surprise Cabbage leaves stuffed with minced meat, grilled chop with vegetables, potatoes baked with blue cheese, pear with chocolate sauce, roasted mandelimi and ice cream, etc. </ li> </ ul> <br /> <br />;499;high;27.1.2014;;48;pcs;in-stock;;garden_tools;garden_tools;;false;;
Filtr uhlíkovı OPK5660 / OPK5760 / OPK6690;OPK5660 carbon filter / OPK5760 / OPK6690;61990003;8594049737390;8845781246010;240 x 205 x 15 mm<br />klazeta s aktivnim uhlikem;240 x 205 x 15 mm <br /> klazeta activated carbon;499;high;28.1.2014;;4984;pcs;in-stock;;garden_tools;garden_tools;;false;;
Filtr uhlíkovı OPK4290;Filter carbon OPK4290;61990004;8594049737437;8845781246011;310 x 285 x 15 mm;310 x 285 x 15 mm;349;high;29.1.2014;;878;pcs;in-stock;;garden_tools;garden_tools;;false;;
Filtr tukovı kovovı OPK-5660/OPK-5760/OPK-6690;Metal grease filter OPK-5660 / OPK-5760 / OPK-6690;61990006;8594049737444;8845781246012;<br />220 x 250 x 9 mm;<br /> 220 x 250 x 9 mm;599;high;30.1.2014;;9877;pcs;in-stock;;garden_tools;garden_tools;;false;;
Filtr tukovı kovovı OPK-4290;Metal grease filter OPK-4290;61990007;8594049737451;8845781246013;<br />320 x 300 x 10 mm;<br /> 320 x 300 x 10 mm;399;high;26.1.2014;;65444;pcs;in-stock;;garden_tools;garden_tools;;false;;
Filtr tukovı kovovı OPV-3260;Metal grease filter OPV-3260;61990008;8594049737468;8845781246014;<br />495 x 200 x 8 mm;<br /> 495 x 200 x 8 mm;499;high;6.2.2014;;798;pcs;in-stock;;garden_tools;garden_tools;;false;;
Redukce prùm. OPK OPO 150/120mm ;Reduction Avg. OPK OPO 150/120 mm;61990013;;8845781246015;;;382;high;4.2.2014;;54;pcs;in-stock;;garden_tools;garden_tools;;false;;
